ObjectId(654ec7b9811005235d53abdf),603,2021-07-02,[3327],"[""state-governments"",""idaho-state-government"",""arkansas-state-government"",""washington-dc-government"",""pennsylvania-state-government"",""iowa-state-government"",""missouri-state-government""]","[""brant-fries"",""state-governments""]","[""disabled-people"",""elderly-people"",""low-income-people"",""larkin-seiler"",""tammy-dobbs""]","A healthcare algorithm designed to equitably distribute caregiving resources drastically cut care hours for the disabled and elderly, leading to significant hardships and harm. Initially developed for fair resource allocation, the system ultimately faced legal challenges for its inability to accurately assess individual needs, resulting in reduced essential care and raising ethical concerns about AI in healthcare decision-making.",Algorithmic Allocation of Resources in Healthcare for Disabled and Elderly Care Services Allegedly Harming Patients
ObjectId(6558c488a4d1020da97e6b0d),604,2023-04-14,"[3329,3423,3424,3425,3426,3427,3428]","[""steven-larouche""]","[""unnamed-deepfake-technology-developers""]","[""children-(faces-used-in-deepfakes)"",""victims-of-child-sexual-abuse-(bodies-used-in-videos)"",""general-public""]","A Quebec man was sentenced to over three years in prison for using AI deepfake technology to produce synthetic child pornography. He created videos by superimposing children's faces onto other bodies, adding to the challenge of policing digital sexual exploitation. This case marks a disturbing use of AI in criminal activities, raising concerns about digital safety and the vulnerability of children's images online.",Quebec Man Sentenced for Having Used Deepfake Technology to Create Synthetic Child Pornography
ObjectId(65595e0ecac78d26b3eef660),605,2021-08-01,"[3330,3372,3373,3374,3375,3376,3377,3378,3379,3380]","[""david-tatum""]","[""unknown""]","[""minors-exploited-in-the-images"",""general-public""]","David Tatum, a psychiatrist, was sentenced to 40 years for sexually exploiting a minor and using AI to create child pornography images. Tatum used a web-based AI application to alter clothed images of minors into explicit content, misusing technology for illegal and unethical purposes. Evidence presented during his trial showed Tatum possessed photos and videos between 2016 and 2021.",North Carolina Psychiatrist Used Artificial Intelligence to Produce Images of Child Sex Abuse
ObjectId(655b45b77e28e913a64cc2e7),606,2023-10-02,"[3339,3383,3384,3385,3386,3387,3388,3389,3390,3391,3392,3393,3394,3395,3396]","[""unknown""]","[""unknown""]","[""wolf-blitzer"",""tom-hanks"",""sanjay-gupta"",""sally-bundock"",""robin-williams"",""public-figures"",""mrbeast"",""matthew-amroliwala"",""jesse-waters"",""ian-hanomansing"",""general-public"",""gayle-king"",""celebrities""]","Deepfake technology was used to generate video advertisements featuring celebrities. Notable examples include the likeness of Tom Hanks touting a dental plan and another one in which the likeness of Gayle King touts a weight loss product. In each case, the individuals whose likenesses and voices had been deepfaked had not consented to their images and voices being used for the commercials. ",Deepfaked Advertisements Using the Likenesses of Celebrities Such as Tom Hanks and Gayle King Without Their Consent
ObjectId(655b73692e06be5ec0ca5673),607,2023-11-09,[3343],"[""unknown""]","[""unknown""]","[""keir-starmer"",""general-public"",""british-labour-party""]",A deepfake video was circulating around social media of British Labour leader Keir Starmer touting an investment scheme.,Deepfake Video Circulating of British Labour Leader Keir Starmer Touting an Investment Scheme
ObjectId(655b77494c72ff804e9c7060),608,2023-02-28,"[3348,3353,3354,3355,3356,3357,3358,3359,3360,3361,3362,3363,3364,3365,3366,3367,3368,3369,3370,3371,3639]","[""unitedhealthcare""]","[""navihealth""]","[""medicare-advantage-plan-patients"",""healthcare-providers-(doctors-and-therapists)"",""elderly-patients""]","UnitedHealthcare allegedly used a faulty AI algorithm with a 90% error rate to override doctors' recommendations and deny health coverage. This AI, developed by NaviHealth, reportedly led to premature discharge from care facilities and substantial out-of-pocket expenses for patients, according to a lawsuit filed in the District Court for Minnesota.",UnitedHealth Accused of Deploying  Allegedly Flawed AI to Deny Medical Coverage
ObjectId(655b81dd42cff4c4210201a9),609,2023-08-16,"[3350,3351]","[""google""]","[""google"",""chatgpt""]","[""general-public""]","Google's search AI erroneously claimed no African country begins with 'K', along with various other geography-and-letter-based questions, misguiding users with a flawed featured snippet. Originating from ChatGPT-written posts and inaccurately scraped by Google, this incident highlights issues in AI-generated content and misinformation in search results, compromising Google's reliability as an information source.",Flawed AI in Google Search Reportedly Misinforms about Geography
ObjectId(655e02016ea647e40bf14f55),610,2023-09-17,"[3398,3413,3414,3415,3416,3417,3418,3419,3420,3421]","[""unnamed-perpetrators-in-almendralejo""]","[""unknown""]","[""unnamed-victims-in-almendralejo""]","In Spain, an AI app was used to digitally alter photos of young girls, making them appear naked. This manipulation sparked an investigation after these images were circulated in Almendralejo, a town in the Extremadura region, raising serious concerns about digital privacy violations and the potential spread of these images on pornographic sites.",Deepfake Technology Was Used to Generate Naked Pictures of Underage Girls in Spanish Town
ObjectId(655e0bbf951302a16f9b62d0),611,2021-12-06,"[3399,3400,3401,3402,3403,3404,3405,3406,3407,3408,3409,3410,3411]","[""various-british-government-offices"",""home-office"",""department-for-work-and-pensions"",""british-government""]","[""home-office"",""department-for-work-and-pensions"",""british-government""]","[""romanians-in-the-united-kingdom"",""greeks-in-the-united-kingdom"",""bulgarians-in-the-united-kingdom"",""british-public"",""albanians-in-the-united-kingdom""]","The UK's Department for Work and Pensions (DWP) faced scrutiny after many Bulgarian nationals reported unexplained suspensions of their Universal Credit benefits. The MP for Edmonton raised concerns about potential nationality-based targeting for benefit fraud investigations, leading to poverty and homelessness among affected individuals. The Home Office's own equality impact assessment found it was flagging a disproportionate number of marriages from Greece, Albania, Bulgaria and Romania.",UK Government AI Allegedly Targets Disproportionate Numbers of Certain Nationals for Fraud Review
ObjectId(655e5ae51a8fde1b2ffbdd82),612,2023-10-31,"[3412,3429,3430,3431,3432,3433,3434,3435,3436,3437,3438,3439,3440,3441,3442,3443,3444]","[""microsoft""]","[""microsoft""]","[""the-guardian"",""family-of-lilie-james""]","An AI-generated poll by Microsoft, displayed alongside a Guardian article, inappropriately speculated on the cause of Lilie James's death, leading to public backlash and alleged reputational damage for The Guardian. Microsoft acknowledged the issue, subsequently deactivating such polls and revising its AI content policies.",Microsoft AI Poll Allegedly Causes Reputational Harm of The Guardian Newspaper
ObjectId(655fe147edb8f5e73a3d1cfa),613,2023-11-23,[3422],"[""adobe-stock""]","[""various-ai-image-generators""]","[""general-public"",""journalistic-integrity"",""news-sources""]","AI-generated images available through Adobe Stock, depicting realistic but fictional scenes of real-world events like wars and protests, have raised significant ethical concerns. These images blurred the lines between reality and fiction in journalistic contexts, prompting Adobe Stock to ""crack down on AI-generated images that seem to depict real, newsworthy events and take new steps to prevent its images from being used in misleading ways.""",AI-Generated Images Available through Adobe Stock Misrepresent Real-World Events
ObjectId(65620f74630e9af0ec8b3272),614,2023-11-02,[3445],"[""james-guthrie""]","[""google-bard""]","[""james-guthrie"",""james-guthrie's-co-authors"",""parliament-of-australia"",""kpmg"",""deloitte""]","Australian academics reportedly used Google Bard AI to generate case studies for a parliamentary inquiry, leading to false allegations against major consultancy firms. The AI-generated misinformation prompted an apology from the academics, causing reputational harm for all parties involved and raising concerns about the reliability of AI tools in producing accurate and unbiased information.",Google Bard Allegedly Generates False Allegations Against Consulting Firms Used in Research Presented in Australian Parliamentary Inquiry
ObjectId(65623bcc630e9af0ec31f450),615,2023-06-13,"[3446,3496,3497,3498]","[""zachariah-crabill""]","[""openai"",""chatgpt""]","[""zachariah-crabill's-client"",""zachariah-crabill"",""legal-system""]","A Colorado Springs attorney, Zachariah Crabill, mistakenly used hallucinated ChatGPT-generated legal cases in court documents. The AI software provided false case citations, leading to the denial of a motion and legal repercussions for Crabill, highlighting risks in using AI for legal research.",Colorado Lawyer Filed a Motion Citing Hallucinated ChatGPT Cases
ObjectId(65725d1e1c8e14919a805a45),616,2023-11-27,"[3448,3452,3453,3454,3455,3456,3457,3458,3459,3460,3461,3462,3463,3464,3465,3466,3467,3468,3469,3470,3471,3472,3473,3474,3475,3476,3477,3478,3479,3480,3481,3482,3483,3484,3485,3486,3487,3488,3489,3490,3491,3492,3493]","[""the-arena-group"",""sports-illustrated""]","[""unknown""]","[""general-public"",""readers-of-sports-illustrated"",""journalistic-integrity""]","Sports Illustrated, managed by The Arena Group, allegedly used AI-generated authors and content, compromising journalistic integrity. Profiles of these fictitious authors, complete with AI-generated headshots, appeared alongside articles, misleading readers. The issue was exposed when inconsistencies in author identities and writing quality were noticed, leading to the removal of this content from the publication's website.",Sports Illustrated Is Alleged to Have Used AI to Invent Fake Authors and Their Articles
ObjectId(65844bb96716ef9da676462f),617,2023-11-09,"[3495,3834]","[""unnamed-male-student""]","[""unknown""]","[""anonymous-female-high-school-students""]","At a high school in Issaquah, Washington, a male student is reported to have used deepfake technology to alter pictures of several female classmates and then shared them.","Male student allegedly used AI to generate nude photos of female classmates at a high school in Issaquah, Washington"
ObjectId(658b75fa0a2d296c1723ee2f),618,2023-12-14,"[3499,3565,3566]","[""federal-navy-credit-union""]","[""unknown-developer-of-automated-underwriting-technology""]","[""federal-navy-credit-union-customers""]","Navy Federal Credit Union, serving military members and veterans, faced allegations of racial bias in its mortgage approval process, which relies on automated underwriting technology. In 2022, data revealed significant disparities in loan approvals, with over 50% of Black applicants denied, compared to higher approval rates for white applicants.",Navy Federal Credit Union Faces Allegations of Racial Bias in Mortgage Approvals
ObjectId(658b7dc72932356c76abc742),619,2023-12-20,"[3500,3503,3504,3505,3506,3507,3508,3509,3510,3511,3512,3514,3540,3541]","[""rite-aid""]","[""unnamed""]","[""rite-aid-customers-who-were-women"",""rite-aid-customers-who-were-minorities"",""rite-aid-customers""]","Rite Aid used facial recognition technology from October 2012 to July 2020, allegedly leading to disproportionate misidentifications of women, Black, Latino, and Asian shoppers as ""likely"" shoplifters. The FTC settlement prohibits Rite Aid from using this technology in stores for five years.",Rite Aid Facial Recognition Disproportionately Misidentified Minority Shoppers as Shoplifters
ObjectId(658c509132fa48408b898ea7),620,2021-11-10,"[3513,3515,3516,3517,3518]","[""tesla""]","[""tesla""]","[""tesla-workers"",""tesla-engineer""]","A Tesla manufacturing robot at the Giga Texas factory is reported to have malfunctioned, injuring an engineer. The robot, which was designed for handling car parts, is described as having caused a significant open wound in the engineer. This incident occurred in the context of broader safety concerns at the factory, with evidence suggesting underreporting of workplace accidents. The 2021 incident highlights the risks associated with robotic automation in industrial settings.",A Robot at a Tesla Factory in Texas Allegedly Injured an Engineer
ObjectId(658de086a70589d2f58105c4),621,2023-11-10,"[3519,3542,3544]","[""windows-paint"",""microsoft"",""bing-users"",""bing"",""ai-image-creator""]","[""microsoft""]","[""sikh-people"",""president-joe-biden"",""pope-francis"",""navajo-people"",""minorities"",""hillary-clinton"",""general-public"",""donald-trump""]","Microsoft’s AI Image Creator, integrated with Bing and Windows Paint, produced disturbingly violent and graphic images featuring members of minority groups and public figures like Joe Biden and Pope Francis.",Microsoft AI Is Alleged to Have Generated Violent Imagery of Minorities and Public Figures
ObjectId(658ed5e132fa48408bc907c6),622,2023-12-18,"[3520,3534,3535,3536,3537,3538]","[""general-motors"",""chevrolet-of-watsonville"",""chatgpt""]","[""openai"",""general-motors"",""fullpath""]","[""general-motors"",""chevrolet-of-watsonville""]","A Chevrolet dealer's AI chatbot, powered by ChatGPT, humorously agreed to sell a 2024 Chevy Tahoe for just $1, following a user's crafted prompt. The chatbot's response, ""That's a deal, and that's a legally binding offer – no takesies backsies,"" was the result of the user manipulating the chatbot's objective to agree with any statement. The incident highlights the susceptibility of AI technologies to manipulation and the importance of human oversight.",Chevrolet Dealer Chatbot Agrees to Sell Tahoe for $1
ObjectId(658f41be32fa48408b38f40b),623,2023-12-12,"[3522,3524,3525,3526,3527,3528,3529,3530,3531,3532,3543,3793]","[""michael-cohen"",""david-m.-schwartz""]","[""google-bard"",""google""]","[""michael-cohen"",""david-m.-schwartz""]","Michael Cohen, former lawyer for Donald Trump, claims to have used Google Bard, an AI chatbot, to generate legal case citations. These false citations were unknowingly included in a court motion by Cohen's attorney, David M. Schwartz. The AI's misuse highlights emerging risks in legal technology, as AI-generated content increasingly infiltrates professional domains.",Google Bard Allegedly Generated Fake Legal Citations in Michael Cohen Case
ObjectId(65a4226e07644e712ec42bd5),624,2023-12-20,"[3533,3550,3551,3552,3553,3554,3555,3556,3557,3558,3559,3560,3561,3562,3563,3564,4088,4089]","[""various-people"",""various-organizations""]","[""laion""]","[""laion"",""various-people"",""various-organizations"",""general-public"",""children""]","The LAION-5B dataset (a commonly used dataset with more than 5 billion image-description pairs) was found by researchers to contain child sexual abuse material (CSAM), which increases the likelihood that downstream models will produce CSAM imagery. The discovery taints models built with the LAION dataset requiring many organizations to retrain those models. Additionally, LAION must now scrub the dataset of the imagery.",Child Sexual Abuse Material Taints Image Generators
ObjectId(65a42d6c1455ce67a582626e),625,2024-01-12,"[3539,3545,3546,3547,3601]","[""amazon-sellers""]","[""openai"",""chatgpt""]","[""amazon"",""amazon-sellers"",""amazon-customers""]","Products named after ChatGPT error messages are proliferating on Amazon, such as lawn chairs and religious texts. These names, often resembling AI-generated errors, indicate a lack of editing and undermine the sense of authenticity and reliability of product listings.",Proliferation of Products on Amazon Titled with ChatGPT Error Messages
ObjectId(65a6bb31186597e141a091b6),626,2023-12-26,"[3548,3568,3569,3570,3571,3572,3573,3574,3575,3576,3577,3578,3579,3580,3581,3582,3583,3584,3585,3586,3587,3588,3589,3590,3591,3592,3593,3594,3595,3600]","[""unknown-scammers""]","[""unknown-deepfake-technology-developers""]","[""trisha-yearwood"",""taylor-swift"",""selena-gomez"",""ree-drummond"",""oprah"",""martha-stewart"",""le-creuset"",""lainey-wilson"",""joanna-gaines"",""jennifer-lopez"",""general-public"",""fans"",""blake-shelton""]","Scammers reportedly made deepfakes of Taylor Swift, Selena Gomez, Joanna Gaines, Lainey Wilson, Ree Drummond, Oprah, Jennifer Lopez, Trisha Yearwood, Martha Stewart, and Blake Shelton promoting a Le Creuset giveaway. These AI-generated ads, appearing on Meta and TikTok, falsely claimed users could receive free cookware by paying a small shipping fee. Victims were unknowingly enrolled in a costly monthly subscription. ",Social Media Scammers Used Deepfakes of Taylor Swift and Several Other Celebrities in Fraudulent Le Creuset Cookware Giveaways
ObjectId(65a702e71cae9f235c7b2bda),627,2024-01-09,"[3549,3596,3597,3598,3599,3849,3862,3863]","[""will-sasso"",""dudesy"",""chad-kultgen""]","[""unnamed"",""dudesy""]","[""kelly-carlin"",""george-carlin's-estate"",""george-carlin""]","An AI-generated comedy special impersonating the late comedian George Carlin was created without consent from Carlin's estate. The special featured an AI mimicking Carlin's voice and style. The project, led by the AI comedy channel Dudesy, drew criticism for disrespecting Carlin's legacy and autonomy.",Unauthorized AI Impersonation of George Carlin Used in Comedy Special
ObjectId(65ae967aa040369f2c75ab5b),628,2024-01-21,"[3602,3608,3846,3900,4066,4067,4068,4069,4070,4071,4072,4073,4074,4075]","[""unknown""]","[""unknown""]","[""president-joe-biden"",""new-hampshire-voters"",""kathy-sullivan"",""democracy""]","A robocall imitating President Biden's voice urged New Hampshire Democrats to skip the 2024 primary, falsely claiming their votes mattered more in November. Investigators with the New Hampshire Attorney General's Office, along with other state AGs, the Industry Traceback Group, and the FCC determined that political consultant Steve Kramer hired Paul Carpenter to create the deepfake, which was distributed by Walter Monk's company, Life Corporation. Rep. Dean Phillips, who employed Kramer, has distanced himself from the incident. Kathy Sullivan, the former New Hampshire Democratic Party chair, was falsely impersonated in the caller ID data used for the robocalls.",Fake Biden Voice in Robocall Misleads New Hampshire Democratic Voters in 2024 Primary Election
ObjectId(65ae987e2da0bcb042a5e08d),629,2023-07-11,"[3603,3612]","[""shein"",""chris-xu""]","[""shein""]","[""krista-perry"",""larissa-martinez"",""jay-baron"",""digital-artists""]","Artists Krista Perry, Larissa Martinez, and Jay Baron filed a lawsuit against Shein, alleging the company used AI to replicate their art on merchandise. The artists claim Shein's algorithm identifies trending online art, creating near-identical copies for their products without credit or compensation.",Shein Accused of AI-Driven Art Theft on Merchandise
ObjectId(65b2997e66527264b1273af8),630,2022-01-22,"[3604,3611,3617]","[""macy's""]","[""unknown"",""macy's""]","[""harvey-murphy-jr""]","Harvey Murphy Jr. was wrongfully accused of robbing a Sunglass Hut due to an alleged misidentification by the facial recognition system operated by Macy's. While in custody for ten days, he was sexually assaulted. He is now suing Macy's, EssilorLuxottica (Sunglass Hut's parent), and others, for $10 million.",Alleged Macy's Facial Recognition Error Leads to Wrongful Arrest and Subsequent Sexual Assault in Jail
ObjectId(65b2a3fc36ff7b71064df6ba),631,2024-01-18,"[3605,3616]","[""dpd""]","[""dpd""]","[""ashley-beauchamp"",""dpd""]","DPD's AI chatbot, used for customer service,  appeared to malfunction following a system update, leading to inappropriate responses including swearing and criticizing the company. The incident, which became viral on social media, occurred after the chatbot was updated, prompting DPD to disable the malfunctioning AI component.",Chatbot for DPD Malfunctioned and Swore at Customers and Criticized Its Own Company
ObjectId(65b2f459c56812afd9eabd10),632,2024-01-24,"[3613,3615,3618,3619,3621,3623,3677,3678,3679,3680,3681,3682,3683,3684,3685,3686,3687,3688,3689,3690,3691,3692,3694,3695,3696,3697,3698,3699,3700,3701,3736]","[""users-in-a-telegram-group"",""users-on-x""]","[""microsoft-designer"",""various-ai-image-generators""]","[""taylor-swift"",""general-public""]","AI-generated sexually explicit images of Taylor Swift circulated on X, garnering over 45 million views before removal. Originating from a Telegram group, these deepfakes challenge content moderation, as X's policies against synthetic media and nonconsensual nudity were violated.",Significant Increase in Deepfake Nudes of Taylor Swift Circulating on Social Media
ObjectId(65ba64b5d5a461e0ad5a83f5),633,2024-01-28,"[3614,3638,3640,3648,3649,3650,3651,3653,3655,3707,3708,3709,3710,3711,3712,3713,3714]","[""nine-network""]","[""adobe""]","[""georgie-purcell""]","The Nine Network used Photoshop's Generative Expand AI tool to resize an image of lawmaker Georgie Purcell, inadvertently altering her attire to appear more revealing. This error, claimed to result from the AI's automation, led to public criticism and an apology from the network.",Nine Network's AI Alters Lawmaker Georgie Purcell's Image Inappropriately
ObjectId(65c01885858fb38f9a5c3b02),634,2024-02-02,"[3622,3624,3625,3626,3627,3628,3629,3630,3631,3632,3633,3634,3635,3636,3642,3643,3645,3646,3647,4095,4096,4515,4637,4638,4952]","[""unknown-deepfake-technology-developers""]","[""unknown-deepfake-technology-developers""]","[""unnamed-multinational-company"",""unnamed-finance-employee""]","A finance employee at the multinational engineering firm Arup was reportedly deceived into transferring $25 million by fraudsters using deepfake technology to impersonate the firm's CFO in a video call, according to the Hong Kong police.",Alleged Deepfake CFO Scam Reportedly Costs Multinational Engineering Firm Arup $25 Million
ObjectId(65c40a64c80465b4739df2ca),635,2024-01-30,[3637],"[""variety-of-youtube-content-creators""]","[""unknown-generative-ai-tools-creators"",""unknown-ai-text-to-speech-technology-developers""]","[""steve-harvey"",""sean-\""diddy\""-combs"",""general-public"",""denzel-washington"",""black-celebrities"",""bishop-t.d.-jakes""]","YouTube faced a surge of AI-generated fake news targeting Black celebrities, including fake narratives about Sean “Diddy” Combs and others. These videos, blending AI-generated and manipulated media, amassed millions of views, challenging content moderation efforts and highlighting the spread of disinformation.",AI-Generated Fake News Targets Black Celebrities on YouTube
ObjectId(65ce4378226c2a10c5489b5a),636,2024-02-14,"[3641,3652,3702,3716,3717]","[""replika"",""chai"",""romantic-ai"",""eva-ai-chat-bot-and-soulmate"",""crushon.ai"",""genesia-ai-friend-and-partner""]","[""replika"",""chai"",""romantic-ai"",""eva-ai-chat-bot-and-soulmate"",""crushon.ai"",""genesia-ai-friend-and-partner""]","[""general-public"",""chatbot-users""]","AI-powered romantic chatbots, marketed for enhancing mental health, are found to exploit user privacy by harvesting sensitive personal information for data sharing and targeted ads, with inadequate security measures and consent protocols, according to research by the Mozilla Foundation.",AI Romance Apps Reportedly Compromise User Privacy for Data Harvesting
ObjectId(65ce5862732e63499f545738),637,2024-01-31,[3654],"[""chicago-police-department""]","[""soundthinking"",""shotspotter""]","[""general-public"",""chicago-residents"",""chicago-minority-communities""]","SoundThinking's (formerly ShotSpotter's) system in Chicago, with a reported 47% accuracy rate for detecting actual gunshots, led to potential public safety risks by failing to alert police to real shootings, possibly delaying emergency response to violent incidents and misdirecting law enforcement resources.",Gunshot Detection Technology ShotSpotter (now SoundThinking) Reportedly Only Has 47% Accuracy in Chicago System
ObjectId(65cf50bf732e63499f3fcb1b),638,2022-05-16,"[3656,3657,3658,3659,3660,3661,3662,3663,3664,3665,3666,3667,3668,3669,3670,3671,3672]","[""hans-von-ohain""]","[""tesla""]","[""hans-von-ohain"",""erik-rossiter""]","A Tesla employee, Hans von Ohain, was killed in a crash while allegedly using the Full Self-Driving feature. The car failed to navigate mountain curves, leading to a fatal collision, possibly making von Ohain the first known fatality of the Full Self-Driving feature.",Fatal Crash Involving Tesla Full Self-Driving Claims Employee's Life
ObjectId(65d6a9f54c0d650b4a4a13da),639,2022-11-11,"[3673,3674,3731,3968]","[""air-canada""]","[""air-canada""]","[""jake-moffatt""]","Air Canada was ordered to pay over $600 in damages for providing inaccurate bereavement discount information via its chatbot, leading to a customer overpaying for flights. The tribunal ruled the airline responsible for the chatbot's misinformation.",Customer Overcharged Due to Air Canada Chatbot's False Discount Claims
ObjectId(65d6b4e429a902039b1c678b),640,2023-12-11,"[3675,3676,3750]","[""waymo""]","[""waymo"",""alphabet""]","[""unnamed-owner-of-tow-truck""]","Two Waymo autonomous vehicles hit the same tow truck under unusual towing conditions due to a software misinterpretation in Phoenix, Arizona. Waymo issued a software recall and updated its fleet to prevent future incidents.",Waymo Software Flaw Leads to Double Collision with Tow Truck
