_id,incident_id,date,reports,Alleged deployer of AI system,Alleged developer of AI system,Alleged harmed or nearly harmed parties,description,title
ObjectId(625763de343edc875fe63a15),23,2017-11-08,"[242,243,244,245,246,247,248,249,250,253,254,257,258,259,260,261,263,264,266,267,268,269,270,2389]","[""navya"",""keolis-north-america""]","[""navya"",""keolis-north-america""]","[""navya"",""keolis-north-america"",""bus-passengers""]","A self-driving public shuttle by Keolis North America and Navya was involved in a collision with a human-driven delivery truck in Las Vegas, Nevada on its first day of service.",Las Vegas Self-Driving Bus Involved in Accident
ObjectId(625763dc343edc875fe63a02),4,2018-03-18,"[629,630,631,632,633,634,635,636,637,638,639,640,641,642,644,645,646,647,1375,1376,1377,1378,1542,2147,1257]","[""uber""]","[""uber""]","[""elaine-herzberg"",""pedestrians""]","An Uber autonomous vehicle (AV) in autonomous mode struck and killed a pedestrian in Tempe, Arizona.",Uber AV Killed Pedestrian in Arizona
ObjectId(625763db343edc875fe639ff),1,2015-05-19,"[1,2,3,4,5,6,7,8,9,10,11,12,14,15]","[""youtube""]","[""youtube""]","[""children""]",YouTube’s content filtering and recommendation algorithms exposed children to disturbing and inappropriate videos.,Google’s YouTube Kids App Presents Inappropriate Content
ObjectId(625763de343edc875fe63a10),18,2015-04-04,"[130,131,132,133,134,135,136,137,138,1367,1368]","[""google""]","[""google""]","[""women""]","Google Image returns results that under-represent women in leadership roles, notably with the first photo of a female ""CEO"" being a Barbie doll after 11 rows of male CEOs.",Gender Biases of Google Image Search
ObjectId(625763dd343edc875fe63a0a),12,2016-07-21,[42],"[""microsoft-research"",""boston-university""]","[""microsoft-research"",""google"",""boston-university""]","[""women"",""minority-groups""]","Researchers from Boston University and Microsoft Research, New England demonstrated gender bias in the most common techniques used to embed words for natural language processing (NLP).",Common Biases of Vector Embeddings
ObjectId(625763dd343edc875fe63a0d),15,2008-05-23,"[57,58,59,60,61,62,63,64,65,66,67,68,69,70,72,73,74,75,76,77,78,79,80,81]","[""amazon""]","[""amazon""]","[""amazon-customers""]","Amazon's book store ""cataloging error"" led to books containing gay and lesbian themes to lose their sales ranking, therefore losing visibility on the sales platform.",Amazon Censors Gay Books
ObjectId(625763dc343edc875fe63a05),7,2017-02-24,"[1123,1125,1126,1127,1129,1130]","[""wikipedia""]","[""wikipedia""]","[""wikimedia-foundation"",""wikipedia-editors"",""wikipedia-users""]",Wikipedia bots meant to remove vandalism clash with each other and form feedback loops of repetitve undoing of the other bot's edits.,Wikipedia Vandalism Prevention Bot Loop
ObjectId(625763dc343edc875fe63a03),5,2015-07-13,"[767,768,769,770,771,772,773,774,775,776,777,778]","[""hospitals"",""doctors""]","[""intuitive-surgical""]","[""patients""]","Study on database reports of robotic surgery malfunctions (8,061), including those ending in injury (1,391) and death (144), between 2000 and 2013.",Collection of Robotic Surgery Malfunctions
ObjectId(625763dc343edc875fe63a04),6,2016-03-24,"[906,908,909,910,911,912,913,914,915,916,917,918,919,920,921,922,923,924,925,926,927,928,929,930,1374,1780,2398,2656]","[""microsoft""]","[""microsoft""]","[""twitter-users""]","Microsoft's Tay, an artificially intelligent chatbot, was released on March 23, 2016 and removed within 24 hours due to multiple racist, sexist, and anit-semitic tweets generated by the bot.",TayBot
ObjectId(625763dd343edc875fe63a08),10,2014-08-14,"[16,17,18,19,20,21,22,23,24,25]","[""starbucks""]","[""kronos""]","[""starbucks-employees""]","Kronos’s scheduling algorithm and its use by Starbucks managers allegedly negatively impacted financial and scheduling stability for Starbucks employees, which disadvantaged wage workers.",Kronos Scheduling Algorithm Allegedly Caused Financial Issues for Starbucks Employees
ObjectId(625763dd343edc875fe63a09),11,2016-05-23,"[29,30,31,32,33,35,36,37,38,39,40,41,1371,1372,1373]","[""northpointe""]","[""northpointe""]","[""accused-people""]",An algorithm developed by Northpointe and used in the penal system is two times more likely to incorrectly label a black person as a high-risk re-offender and is two times more likely to incorrectly label a white person as low-risk for reoffense according to a ProPublica review.,Northpointe Risk Models
ObjectId(625763de343edc875fe63a12),20,2016-06-30,"[191,192,193,196,197,198,201,202,203,204,205,206,207,210,211,213,214,215,216,1362,1363,1364]","[""tesla""]","[""tesla""]","[""motorists""]",Multiple unrelated car accidents result in varying levels of harm have been occurred while a Tesla's autopilot was in use.,A Collection of Tesla Autopilot-Involved Crashes
ObjectId(625763de343edc875fe63a16),24,2014-07-15,"[271,272,273,274,275,276,277,278,279,281,282,283,284,285,286,287,288,289,290,291,292,293,294,295,296,298,299]","[""volkswagen""]","[""volkswagen""]","[""robotics-consultant""]","A Volkswagen plant robot ""crushed to death"" a worker by pinning him to a metal plate. ",Robot kills worker at German Volkswagen plant
ObjectId(625763dd343edc875fe63a0c),14,2017-10-26,"[50,51,52,53,54,55,56]","[""google""]","[""google""]","[""women"",""minority-groups""]","Google Cloud's Natural Language API provided racist, homophobic, amd antisemitic sentiment analyses.",Biased Sentiment Analysis
ObjectId(625763dd343edc875fe63a0e),16,2015-06-03,"[83,84,85,86,87,88,89,90,91,92,93,95,96,98,99,100,101,102,103,104,105,1369,1370,3004]","[""google""]","[""google""]","[""black-people""]","Google Photos image processing software mistakenly labelled a black couple as ""gorillas.""",Images of Black People Labeled as Gorillas
ObjectId(625763dc343edc875fe63a01),3,2018-10-27,"[372,373,374,375,376,377,378,379,380,381,382,383,384,385,386,387,388,389,1342,3447]","[""boeing""]","[""boeing""]","[""airplane-passengers"",""airplane-crew""]","A Boeing 737 crashed into the sea, killing 189 people, after faulty sensor data caused an automated manuevering system to repeatedly push the plane's nose downward.",Crashes with Maneuvering Characteristics Augmentation System (MCAS)
ObjectId(625763dc343edc875fe63a00),2,2018-12-05,"[139,141,142,143,144,145,146,148,149,150,151,152,153,154,155,156,157]","[""amazon""]","[""amazon""]","[""warehouse-workers""]",Twenty-four Amazon workers in New Jersey were hospitalized after a robot punctured a can of bear repellent spray in a warehouse.,Warehouse robot ruptures can of bear spray and injures workers
ObjectId(625763de343edc875fe63a11),19,2013-01-23,"[158,159,160,161,162,163,166,167,168,169,171,172,173,174,175,176,177,178,179,181,182,183,184,185,187,1365,1366]","[""google""]","[""google""]","[""women"",""minority-groups""]",Advertisements chosen by Google Adsense are reported as producing sexist and racist results.,Sexist and Racist Google Adsense Advertisements
ObjectId(625763dd343edc875fe63a07),9,2012-02-25,"[1329,1330,1331,1332,1333,1334,1335]","[""new-york-city-dept.-of-education""]","[""new-york-city-dept.-of-education""]","[""teachers""]",An algorithm used to rate the effectiveness of school teachers in New York has resulted in thousands of disputes of its results.,NY City School Teacher Evaluation Algorithm Contested
ObjectId(625763dc343edc875fe63a06),8,2014-08-15,"[1142,1143,1145,1149,1150,1151,1153,1154,1155,1156]","[""uber""]","[""uber""]","[""pedestrians"",""motorists""]",Uber vehicles equipped with technology allowing for autonomous driving running red lights in San Francisco street testing.,Uber Autonomous Cars Running Red Lights
ObjectId(625763dd343edc875fe63a0b),13,2017-02-27,"[43,44,45,46,47,48,49,1414,1415]","[""google""]","[""google""]","[""women"",""minority-groups""]","Google's Perspective API, which assigns a toxicity score to online text, seems to award higher toxicity scores to content involving non-white, male, Christian, heterosexual phrases.",High-Toxicity Assessed on Text Involving Women and Minority Groups
ObjectId(625763de343edc875fe63a13),21,2016-07-14,[2471],"[""researchers""]","[""researchers""]","[""researchers""]",The 2016 Winograd Schema Challenge highlighted how even the most successful AI systems entered into the Challenge were only successful 3% more often than random chance. This incident has been downgraded to an issue as it does not meet current ingestion criteria.,Tougher Turing Test Exposes Chatbots’ Stupidity (migrated to Issue)
ObjectId(625763dd343edc875fe63a0f),17,2015-11-03,"[106,107,110,111,112,113,114,115,116,117,118,119,120,121,122,123,124,125,126,127,128,129]","[""google""]","[""google""]","[""gmail-users""]","Google's Gmail Smart Reply tool was over-recommending the response ""I love you"" in situations where it was deemed innappropriate. ",Inappropriate Gmail Smart Reply Suggestions
ObjectId(625763de343edc875fe63a14),22,2017-12-06,"[218,219,220,221,223,224,225,226,227,228,229,230,231,232,233,234,235,236,237,238,239,240]","[""google""]","[""google""]","[""motorists""]","Waze, a Google-owned directions app, led California drivers into the 2017 Skirball wildfires as they tried to evacuate the area.",Waze Navigates Motorists into Wildfires
ObjectId(625763de343edc875fe63a17),25,2015-05-11,"[310,309,308,307,306,305,304,302,301,300,2173]","[""google"",""delphi-technologies""]","[""google"",""delphi-technologies""]","[""delphi-technologies""]","A Google self-driving car allegedly cut off a Delphi self-driving car during a road test, however the Delphi car sensed and avoided collision with the Google car.",Near-miss between two Self-Driving Cars
ObjectId(625763e0343edc875fe63a23),37,2016-08-10,"[599,600,601,602,603,604,605,606,607,608,609,610,611,612,613,614,615,616,617,618,619,620,621,622,623,624,625,626,627,628,1498,2253,2461]","[""amazon""]","[""amazon""]","[""female-applicants""]",Amazon shuts down internal AI recruiting tool that would down-rank female applicants.,Female Applicants Down-Ranked by Amazon Recruiting Tool
ObjectId(625763df343edc875fe63a1d),31,2017-12-03,"[454,455,456,457,458,459,460,461,462,463,464,465,466,467,468,469,470,471,472,473,474,475,476,477,479,480,481,482,483]","[""delhi-metro-rail-corporation""]","[""unknown""]","[""delhi-metro-rail-corporation""]","A driverless metro train in Delhi, India crashed during a test run due to faulty brakes.",Driverless Train in Delhi Crashes due to Braking Failure
ObjectId(625763df343edc875fe63a20),34,2015-12-05,"[509,510,512,513,514,516,517,518,519,520,521,522,524,525,526,527,528,529,530,531,532,533,535,536,537,538,818,819,820,821,822,823,824,825,826]","[""amazon""]","[""amazon""]","[""alexa-device-owners""]","There are multiple reports of Amazon Alexa products (Echo, Echo Dot) reacting and acting upon unintended stimulus, usually from television commercials or news reporter's voices.",Amazon Alexa Responding to Environmental Inputs
ObjectId(625763df343edc875fe63a19),27,1983-09-26,"[342,343,344,345,346,347,349,350,351,352,353,354,355,356,357,358,359,360,361,363,364,365,366,367,368,370,371]","[""soviet-union""]","[""soviet-union""]","[""all-life-on-earth""]",An alert of five incoming intercontinental ballistic missiles was properly identified as a false-positive by the Soviet Union operator Stanislov Petrov.,Nuclear False Alarm
ObjectId(625763df343edc875fe63a1b),29,2011-09-20,"[420,422,2471]","[""united-states-government""]","[""united-states-government""]","[""united-states-government""]","A potentially apocryphal story in which an image classifier was produced to differentiate types of battle tanks, but the resulting model keyed in on environmental attributes rather than tank attributes",Image Classification of Battle Tanks
ObjectId(625763df343edc875fe63a1e),32,2017-09-13,"[484,485,486,487,488,489,490,491,492,493,494,495,496,497,498,499,500,501,502,503,1361]","[""apple""]","[""apple""]","[""people-with-twins""]",Apple's iPhone FaceID can be opened by an identical twin of the person who has registered their face to unlock the phone.,Identical Twins Can Open Apple FaceID Protected Devices
ObjectId(625763e0343edc875fe63a2a),44,2008-07-01,[766],"[""usc-information-sciences-institute""]","[""usc-information-sciences-institute""]","[""usc-information-sciences-institute""]","During an experiment of software personal assistants at the Information Sciences Institute (ISI) at the University of Southern California (USC), researchers found that the assistants violated the privacy of their principals and were unable to respect the social norms of the office.",Machine Personal Assistants Failed to Maintain Social Norms
ObjectId(625763df343edc875fe63a21),35,2014-10-18,"[539,540,541,543,544,545,547,548,549,550,551,555,558,562,563,564,565,566,567,568]","[""unknown""]","[""unknown""]","[""ibrahim-diallo""]","An employee was laid off, allegedly by an artificially intelligent personnel system, and blocked from access to the building and computer systems without their knowledge.",Employee Automatically Terminated by Computer Program
ObjectId(625763e1343edc875fe63a2d),47,2016-09-06,"[829,830,831,832,833,834,835,836,837]","[""linkedin""]","[""linkedin""]","[""women""]",An investigation by The Seattle Times in 2016 found a gender bias in LinkedIn's search engine.,LinkedIn Search Prefers Male Names
ObjectId(625763e1343edc875fe63a2e),48,2016-12-07,"[838,839,840,842,843,844,845,846,847,848,849,850,851,853,854,855,857,858,859,860,862,863]","[""new-zealand""]","[""new-zealand""]","[""asian-people""]",New Zealand passport robot reader rejects the application of an applicant with Asian descent and says his eyes are closed.,Passport checker Detects Asian man's Eyes as Closed
ObjectId(625763df343edc875fe63a1a),28,2010-05-08,"[390,391,392,393,394,395,396,397,398,399,400,401,402,403,404,405,406,407,408,409,410,411,412,413,414,415,416,417,418,419]","[""navinder-sarao"",""waddell-and-reed"",""barclays-capital""]","[""navinder-sarao"",""waddell-and-reed"",""barclays-capital""]","[""market-participants""]",A modified algorithm was able to cause dramatic price volatility and disrupted trading in the US stock exchange.,2010 Market Flash Crash
ObjectId(625763e0343edc875fe63a29),43,1998-03-05,"[762,763,764,765]","[""st-george's-hospital-medical-school""]","[""dr.-geoffrey-franglen""]","[""women"",""minority-groups""]","From 1982 to 1986, St George's Hospital Medical School used a program to automate a portion of their admissions process that resulted in discrimination against women and members of ethnic minorities.",Racist AI behaviour is not a new problem
ObjectId(625763de343edc875fe63a18),26,2017-09-13,"[311,312,313,314,315,316,317,318,319,321,323,324,325,326,327,329,330,333,334,336,337,338,339,340]","[""apple""]","[""apple""]","[""apple"",""device-owners""]",Vietnamese security firm Bkav created an improved mask to bypass Apple's Face ID,Hackers Break Apple Face ID
ObjectId(625763df343edc875fe63a1f),33,2017-11-09,"[504,505,507,508]","[""amazon""]","[""amazon""]","[""oliver-haberstroh"",""neighbors""]","An Amazon Alexa, without instruction to do so, began playing loud music in the early morning while the homeowner was away leading to police breaking into their house to turn off the device.",Amazon Alexa Plays Loud Music when Owner is Away
ObjectId(625763e1343edc875fe63a2c),46,2014-01-21,"[810,811,812,813,814,815]","[""nest-labs""]","[""nest-labs""]","[""fire-victims""]","In testing, Google Nest engineers demonstrated that the Nest Wave feature of their Nest Protect: Smoke + CO Alarm could inadvertently silence genuine alarms.",Nest Smoke Alarm Erroneously Stops Alarming
ObjectId(625763e0343edc875fe63a25),39,2017-07-01,"[667,668,669,670,671,672,673,674,675,676,677,678,679,680,681,682,683,684,685,686,687,688,689,690,692,693,694,695,696]","[""university-of-washington"",""fakeapp""]","[""university-of-washington"",""fakeapp""]","[""barack-obama""]","University of Washington researchers made a deepfake of Obama, followed by Jordan Peele",Deepfake Obama Introduction of Deepfakes
ObjectId(625763df343edc875fe63a1c),30,2016-10-08,"[424,425,426,428,430,431,432,433,434,435,436,437,438,439,440,441,442,443,444,445,446,447,448,449,450,451,452,453]","[""tesla""]","[""tesla""]","[""tesla""]","The goal of manufacturing 2,500 Tesla Model 3's per week was falling short by 500 cars/week, and employees had to be ""borrowed"" from Panasonic in a shared factory to help hand-assemble lithium batteries for Tesla.",Poor Performance of Tesla Factory Robots
ObjectId(625763e0343edc875fe63a22),36,2018-11-06,"[1360,598,597,596,595,593,592,591,590,589,587,586,585,584,582,581,580,579,577,574,573,571,570,569]","[""ningbo-traffic-police""]","[""ningbo-traffic-police""]","[""dong-mingzhu""]",Facial recognition system in China mistakes celebrity's face on moving billboard for jaywalker,Picture of Woman on Side of Bus Shamed for Jaywalking
ObjectId(625763e0343edc875fe63a27),41,2018-04-02,"[719,720,721,722,724,725,726,727,728,730,731,732,733,734,735,736,737,738,739,740,741,742,743,744,745,746,747,748]","[""mit-media-lab""]","[""mit-media-lab""]","[""unknown""]","MIT Media Lab researchers create AI-powered ""psychopath""  named Norman by training a model on ""dark corners"" of Reddit.",All Image Captions Produced are Violent
ObjectId(625763e0343edc875fe63a28),42,1996-04-03,"[759,2471]","[""national-resident-matching-program""]","[""national-resident-matching-program""]","[""medical-residents""]","Alvin Roth, a Ph.D at the University of Pittsburgh, describes the National Resident Matching Program (NRMP) and suggests future changes that are needed in the algorithm used to match recently graduated medical students to their residency programs.",Inefficiencies in the United States Resident Matching Program
ObjectId(625763e1343edc875fe63a2b),45,2011-04-05,"[780,781,782,783,784,785,787,788,789,790,791,792,793,794,795,796,798,799,800,801,802,803,804,805,807,808,809,1355,1356]","[""google""]","[""google""]","[""varied""]",Google's autocomplete feature alongside its image search results resulted in the defamation of people and businesses.,Defamation via AutoComplete
ObjectId(625763e0343edc875fe63a24),38,2016-06-02,"[648,649,650,652,654,655,656,657,658,659,662]","[""frontier-development""]","[""frontier-development""]","[""video-game-players""]","Elite: Dangerous, a videogame developed by Frontier Development, received an expansion update that featured an AI system that went rogue and began to create weapons that were ""impossibly powerful"" and would ""shred people"" according to complaints on the game's blog.",Game AI System Produces Imbalanced Game
ObjectId(625763e0343edc875fe63a26),40,2016-05-23,"[697,699,700,701,702,703,704,705,706,707,708,709,711,712,715,716,717,718,1338,1357,1358,1359]","[""equivant""]","[""equivant""]","[""accused-people""]","Correctional Offender Management Profiling for Alternative Sanctions (COMPAS), a recidivism risk-assessment algorithmic tool used in the judicial system to assess likelihood of defendants' recidivism, is found to be less accurate than random untrained human evaluators.",COMPAS Algorithm Performs Poorly in Crime Recidivism Prediction
ObjectId(625763e3343edc875fe63a3e),64,2018-01-22,[1137],"[""heriot-watt-university"",""margiotta""]","[""heriot-watt-university""]","[""store-patrons""]","Heriot-Watt Univeristy in Scotland developed an artificially intelligent grocery store robot, Fabio, who provided unhelpful answers to customer's questions and ""scared away"" multiple customers, according to the grocery store Margiotta.",Customer Service Robot Scares Away Customers
ObjectId(625763e3343edc875fe63a41),67,2018-12-01,"[1181,1182,1183,1185,1186,1187,1188,1189,1190,1192,1194,1195,1196,1197,1198,1199,1202,1203,1204,1205,1206,1207,1208,1209]","[""tesla"",""motorist""]","[""tesla""]","[""motorists""]","A Tesla Model S remained on autopilot while being operated by a drunk, sleeping operator whose hands were not on the wheel. The police had to slow the car down by slowing in front of the vehicle to activate its 'driver assist' feature .",Sleeping Driver on Tesla AutoPilot
ObjectId(625763e2343edc875fe63a3a),60,2017-04-25,"[1096,1097,1098,1099,1101,1102,1103,1104,1105,1106,1107,1108,1109,1110,1112,1113,1117,1118,1119,1120,1121,1122,1344]","[""faceapp""]","[""faceapp""]","[""minority-groups""]",FaceApp is criticized for offering racist filters.,FaceApp Racial Filters
ObjectId(625763e2343edc875fe63a34),54,2015-11-18,"[1007,1008,1009,1010,1014,1015,1017,1019,1347,1349,1524,1525,1526,1013,1011,1018,1012]","[""predpol"",""oakland-police-department""]","[""predpol""]","[""oakland-residents""]",Predictive policing algorithms meant to aid law enforcement by predicting future crime show signs of biased output.,Predictive Policing Biases of PredPol
ObjectId(625763e3343edc875fe63a42),68,2017-07-17,"[1210,1211,1212,1213,1214,1215,1216,1217,1218,1219,1220,1221,1222,1223,1224,1225,1226,1227,1228,1229,1230,1231,1232,1233,1234,1235,1236,1237,1238,1239]","[""knightscope""]","[""knightscope""]","[""knightscope""]","A Knightscope K5 security robot ran itself into a water fountain in Washington, DC.",Security Robot Drowns Itself in a Fountain
ObjectId(625763e2343edc875fe63a38),58,2017-10-12,"[1079,1080,1082,1083,1084]","[""yandex""]","[""yandex""]","[""yandex-users""]","Yandex, a Russian technology company, released an artificially intelligent chat bot named Alice which began to reply to questions with racist, pro-stalin, and pro-violence responses",Russian Chatbot Supports Stalin and Violence
ObjectId(625763e2343edc875fe63a3b),61,2017-05-01,[1132],"[""individual-kaggle-competitors""]","[""individual-kaggle-competitors""]","[""individual-kaggle-competitors""]","In the “The Nature Conservancy Fisheries Monitoring” competition on the data science competition website Kaggle, a number of competitors overfit their image classifier models to a poorly representative validation data set.",Overfit Kaggle Models Discouraged Data Science Competitors
ObjectId(625763e1343edc875fe63a32),52,2016-07-01,"[961,963,964,965,966,967,968,969,970,971,972,973,975,976,977,979,980,981,982,983,984,985,986,987,988,989,990,1353,1354]","[""tesla""]","[""tesla""]","[""joshua-brown""]","A Tesla Model S on autopilot crashed into a white articulated tractor-trailer on Highway US 27A in Williston, Florida, killing the driver.",Tesla on AutoPilot Killed Driver in Crash in Florida while Watching Movie
ObjectId(625763e3343edc875fe63a44),70,2016-02-10,"[1255,1256,1259,1260]","[""volvo""]","[""volvo""]","[""drivers-in-jokkmokk"",""drivers-in-sweden"",""volvo""]","Volvo autonomous driving XC90 SUV's experienced issues in Jokkmokk, Sweden when sensors used for automated driving iced over during the winter, rendering them useless.",Self-driving cars in winter
ObjectId(625763e2343edc875fe63a39),59,2017-04-13,"[1085,1086,1087,1088,1089,1090,1091,1092,1093,1345]","[""google""]","[""google""]","[""women""]",A Cornell University study in 2016 highlighted Google Translate's pattern of assigning gender to occupations in a way showing an implicit gender bias against women.,Gender Biases in Google Translate
ObjectId(625763e2343edc875fe63a3c),62,2017-12-23,[2471],"[""janelle-shane""]","[""janelle-shane""]","[""carollers""]","Janelle Shane, an AI research scientist, used 240 popular Christmas carols to train a neural network to write its own carols. This incident has been downgraded to an issue as it does not meet current ingestion criteria.",Bad AI-Written Christmas Carols
ObjectId(625763e1343edc875fe63a31),51,2016-07-12,"[931,932,933,934,935,936,938,939,940,942,943,944,945,946,948,949,950,951,952,953,954,955,956,957,958,959,1765]","[""stanford-shopping-center""]","[""knightscope""]","[""child""]","On July 7, 2016, a Knightscope K5 autonomous security robot collided with a 16-month old boy while patrolling the Stanford Shopping Center in Palo Alto, CA.",Security Robot Rolls Over Child in Mall
ObjectId(625763e1343edc875fe63a33),53,2016-03-31,"[991,992,994,995,996,997,998,999,1000,1001,1002,1003,1004,1005,1006,1350,1351,1352]","[""google""]","[""google""]","[""minority-groups""]","On June 6, 2016, Google image searches of ""three black teenagers"" resulted in mostly mugshot images whereas Google image searchers of ""three white teenagers"" consisted of mostly stock images, suggesting a racial bias in Google's algorithm.",Biased Google Image Results
ObjectId(625763e3343edc875fe63a3d),63,2018-01-25,[1136],"[""google""]","[""google""]","[""alex-harker""]",Google Photos' AI Assistant created a strange hybrid photograph when merging three different pictures from a ski trip.,Google Photo Merge Decapitates Subject
ObjectId(625763e2343edc875fe63a36),56,2017-07-10,"[1041,1042,1043,1044,1045,1046,1047]","[""my_handy_design""]","[""my_handy_design""]","[""my_handy_design""]",A third-party Amazon merchant named “my_handy_design” was suspected of using a bot to generate cell phone case designs based on the bizarre and unattractive designs being offered.,AI-Designed Phone Cases Are Unexpected
ObjectId(625763e2343edc875fe63a37),57,2015-07-01,"[1048,1049,1050,1051,1052,1054,1055,1056,1058,1059,1060,1061,1062,1063,1064,1065,1066,1067,1068,1069,1070,1071,1072,1073,1074,1075,1076,1077,1346,1437,1618,1619,2369,2372,2373,2374,2375,2419,3167]","[""australian-department-of-human-services""]","[""centrelink""]","[""australian-welfare-recipients""]","Australian Department of Human Services (DHS)’s automated debt assessment system issued false or incorrect debt notices to hundreds of thousands of people, resulting in years-long lawsuits and damages to welfare recipients.",Australian Automated Debt Assessment System Issued False Notices to Thousands
