ObjectId(66e70a8be5f5babea248e753),794,2024-08-13,"[4082,4083]","[""waymo""]","[""waymo""]","[""san-francisco-residents"",""south-of-market-residents"",""south-of-market-businesses""]","Waymo self-driving cars in San Francisco's South of Market neighborhood began honking at each other late at night, disturbing residents' sleep. The autonomous vehicles, using a parking lot for ride pauses, triggered honking due to a glitch in their algorithms. Despite residents' complaints, the issue persisted for weeks until Waymo acknowledged the problem and began working on a fix.",Glitch in Waymo Self-Driving Cars Triggers Regular All-Night Honking in San Francisco
ObjectId(66e71167e5f5babea248e75a),795,2024-08-14,"[4084,4384]","[""unknown-deepfake-creators"",""unknown-scammers""]","[""unknown-deepfake-technology-developers""]","[""elderly-investors"",""cryptocurrency-users"",""online-investors"",""social-media-users"",""retirees-seeking-investment-opportunities"",""steve-beauchamp"",""elon-musk""]","Scammers used AI to create deepfake videos of Elon Musk promoting fraudulent investment opportunities. Over time, these scams have reportedly led to billions in investor losses. The deepfakes also use voice cloning technology. They have been distributed on social media and YouTube. In particular, they target the elderly, such as 82-year-old Steve Beauchamp, to invest significant sums. Despite efforts by platforms to remove these videos, the scams continue to proliferate.",Deepfake Elon Musk Videos Have Reportedly Contributed to Billions in Fraud
ObjectId(66e71634915c4bc10ca7ebd0),796,2024-06-01,"[4087,4100,4101]","[""meta"",""facebook""]","[""meta"",""facebook""]","[""california-residents"",""wildfire-evacuees"",""emergency-responders"",""disaster-relief-workers"",""fire-safety-coordinators"",""facebook-users"",""facebook-users-in-disaster-zones""]","Facebook's AI moderation system wrongly flagged and removed dozens of posts containing vital emergency information during California's wildfire season, including real-time updates on evacuations and fire tracking. Posts from official sources like Cal Fire and the U.S. Forest Service were marked as spam, potentially endangering lives by restricting access to crucial updates. Despite user complaints, the issue persisted, with Facebook acknowledging the problem only after media inquiry.",Facebook's Content Moderation System Flagged and Removed Emergency Updates as Spam During Wildfires
ObjectId(66e7279eeacc34f5a03c9549),797,2024-06-07,"[4090,4105,4106,4107,4108]","[""unnamed-adolescent-male"",""instagram-users"",""snapchat-users""]","[""unknown-deepfake-technology-developer""]","[""bacchus-marsh-grammar-students"",""bacchus-marsh-grammar-girls""]","At Bacchus Marsh Grammar, a school in Victoria state in Australia, an adolescent male made deepfake pornography of 50 girls, ages 9 to 12. He then allegedly uploaded the pictures to Instagram, and others subsequently shared them on Snapchat. ",Teenager Makes Deepfake Pornography of 50 Girls at Bacchus Marsh Grammar School in Australia
ObjectId(66e727ee8860beebcd77f6bd),798,2024-06-29,[4091],"[""australian-students"",""unknown-deepfake-creators""]","[""undress-ai"",""unknown-deepfake-technology-developers""]","[""australian-students"",""australian-children""]","Throughout 2024, schools in Australia dealt with a significant rise and proliferation of non-consensual deepfake pornography of students. Often, male students are reported to use ""nudify"" apps such as Undress AI with images of their classmates and teachers. Many of the sites have remained legal and accessible to minors, who in turn are using the sites to generate pornography of their peers.",Australian Schools Grappling with Significant Spread of Non-Consensual Spread of Deepfake Pornography of Students
ObjectId(66e7448cd7e4fecbae371f50),799,2023-10-15,"[4092,4093,4543,4544,4545,4546,4547,4549,4550,4551,4552,4553,4554,4555,4556,4557,4558,4559,4561,4562,4563,4564,4565,4566,4567,4568]","[""unnamed-male-student""]","[""unknown-deepfake-technology-developer""]","[""elliston-berry"",""aledo-high-school-students""]","In October 2023, an unnamed male student at Aledo High School outside of Fort Worth, Texas allegedly generated and distributed deepfake nude pictures of classmate Elliston Berry and six other female students in her friend group via social media. Berry's mother, Anna McAdams, spoke with Senators Ted Cruz and Amy Klobuchar, who consequently drafted the Tools to Address Known Exploitation by Immobilizing Technological Deepfakes on Websites and Networks (or TAKE IT DOWN) Act.",Aledo High School Student Allegedly Generates and Distributes Deepfake Nudes of Seven Female Classmates
ObjectId(66e74e2add08c9a6ce651181),800,2024-09-03,"[4094,4516]","[""unknown-scammers"",""unknown-deepfake-creators""]","[""unknown-deepfake-technology-developers""]","[""american-businesses"",""british-businesses"",""finance-professionals"",""employees"",""arup""]","According to Medius, Deepfake scams have targeted 53% of businesses in the U.S. and U.K., with 43% falling victim. Using AI to create realistic fake videos and audio of corporate executives, scammers have successfully stolen millions, including $25 million from British engineering group Arup. ",53% of American and British Businesses Report Attacks by AI-Powered Deepfake Scams in 2024
ObjectId(66e75732a892906c49c6da4c),801,2024-09-02,[4097],"[""unknown-deepfake-detection-technology-developers"",""true-media"",""reality-defender""]","[""unknown-deepfake-detection-technology-developers"",""true-media"",""reality-defender""]","[""global-south-citizens"",""political-researchers"",""global-south-local-fact-checkers"",""non-native-english-speakers"",""global-south-journalists"",""civil-society-organizations-in-developing-countries""]","AI deepfake detection tools are reportedly failing voters in the Global South due to biases in their training data. These tools, which prioritize English language and Western faces, show reduced accuracy when detecting manipulated content from non-Western regions. As a result of this detection gap, election integrity faces threats from and the amplification of misinformation, which leaves journalists and researchers with inadequate resources to combat the issue.",Bias in AI Deepfake Detection Undermines Election Security in Global South
ObjectId(66e829a7e68ff0d8fb71369f),802,2024-09-13,[4098],"[""unknown-deepfake-creator"",""unknown-scammers""]","[""unknown-deepfake-technology-developer""]","[""tiktok-users"",""queen-(band)-fans"",""brian-may-fans""]","Scammers created an AI-generated deepfake of Queen guitarist Brian May, posting a video on TikTok in which the fake May offers backstage tickets to a Queen concert. The real Brian May warned fans about this ""disgusting"" scam, emphasizing that Queen has no tour dates planned and does not sell backstage access.",AI Deepfake of Brian May Exploited in Scam Offering Fake Queen Backstage Tickets
ObjectId(66e8322ba48f37c95bff900b),803,2024-05-14,[4102],"[""meta"",""facebook""]","[""meta"",""facebook""]","[""meta-users"",""facebook-users""]","AI-generated spam images are increasingly filling Facebook feeds, with the platform’s algorithm reportedly amplifying these posts. Many of these images are bizarre, fake, and used in scams, misleading users into engaging with non-existent products or clickbait. ","Facebook's Algorithm Reportedly Amplifies AI-Generated Content, Fueling Misleading Posts"
ObjectId(66ec2d1a2e5531f551c05057),804,2024-07-30,"[4110,4132,4133,4134,4135]","[""true-crime-case-files-youtube-channel""]","[""unknown-deepfake-technology-developers""]","[""viewers-of-true-crime-case-files-youtube-channel"",""residents-of-littleton""]","An AI-generated ""true crime"" video on YouTube falsely depicted a Littleton man's ""secret gay love affair"" and murder by his stepson. The 25-minute video, which garnered nearly 2 million views, fabricated details and used deepfake technology to deceive viewers into believing the story was real. Despite being flagged as false by local authorities and lacking credible sources, the video sparked widespread misinformation and outrage online.",AI-Generated Fake 'True Crime' Video About Non-Existent Littleton Murder Goes Viral
ObjectId(66f5cc37b103802936a2c728),805,2024-09-19,"[4111,4112,4115,4125,4126,4127,4128,4129,4130,4131]","[""unknown-deepfake-creator""]","[""unknown-deepfake-technology-creator""]","[""ben-cardin"",""dmytro-kuleba""]",Senator Ben Cardin was targeted by a deepfake impersonating former Ukrainian Foreign Minister Dmytro Kuleba on a Zoom video call. The AI-generated video mimicked the appearance and voice of the official but raised suspicion with unusual questions.,Senator Ben Cardin Targeted with Deepfake Zoom Video Call Posing as Former Ukrainian Foreign Minister Dmytro Kuleba
ObjectId(66f5dfe283c525a6b1b3efc1),806,2024-09-13,[4114],"[""hu-mouyun"",""hu-mouliang"",""zhang-mouguo"",""wu-mouhao""]","[""unknown-deepfake-detection-technology-developers""]","[""chinese-citizens"",""zhejiang-citizens"",""anhui-citizens"",""guizhou-citizens""]","A criminal group in China used AI face-swapping technology to bypass face recognition systems on major platforms, steal personal data, and sell it to fraud syndicates. The group generated convincing video simulations from static photos to breach accounts, reportedly earning 200,000 yuan. After an investigation by the Hangzhou Public Security Bureau, four suspects were arrested across the provinces of Anhui, Guizhou, and Zhejiang.","Criminal Group Uses AI Deepfake Technology to Steal Personal Data in Hangzhou, Zhejiang"
ObjectId(67081d1508b5d13e244e27b8),807,2024-09-25,"[4136,4137,4138,4139,4140,4141,4143]","[""department-of-families-fairness-and-housing"",""government-of-victoria"",""employee-of-department-of-families-fairness-and-housing""]","[""openai""]","[""unnamed-child"",""unnamed-family-of-child""]","A child protection worker in Victoria used ChatGPT to draft a report submitted to the Children's Court. The AI-generated report contained inaccuracies and downplayed risks to the child, resulting in a privacy breach when sensitive information was shared with OpenAI. ",ChatGPT Introduces Errors in Critical Child Protection Court Report
ObjectId(670a7358fe16ccb511ce64a4),808,2024-10-11,[4142],"[""nevada-department-of-education""]","[""infinite-campus""]","[""low-income-students-in-nevada"",""nevada-school-districts"",""mater-academy-of-nevada"",""somerset-academy""]","An AI system developed by Infinite Campus and deployed by Nevada to identify at-risk students led to a sharp reduction in the number classified as needing support, dropping from 270,000 to 65,000. The reclassification caused significant budget cuts in schools serving low-income populations. The drastic reduction in identified at-risk students reportedly left thousands of vulnerable children without resources and support.",Infinite Campus AI-Driven Student Risk Model Leads to Cuts in Support for Nevada's Low-Income Schools
ObjectId(670a868466c147452f7910b7),809,2024-04-07,[4144],"[""unknown-deepfake-creators""]","[""unknown-deepfake-technology-developers""]","[""tiktok-users""]","AI-generated English-language Adolf Hitler speeches have been proliferating on TikTok. They are reportedly accumulating millions of views despite violating the platform’s hate speech policies. The clips are described as often pairing the audio with misleading translations and memes that glorify Hitler and distort historical facts. While some content has been removed, many accounts reportedly continue to post similar videos.",TikTok Hosts AI-Generated English-Language Hitler Speeches with Millions of Views
ObjectId(670a8daa9f4ddc73e11d6068),810,2024-07-29,[4146],"[""unknown-ai-developers""]","[""pro-nazi-tiktok-accounts""]","[""tiktok-users""]","A coordinated neo-Nazi network on TikTok used AI-generated media, including Hitler speeches, to spread Nazi propaganda and extremist content, violating TikTok’s hate speech policies. The network evaded platform moderation through coded language, imagery, and music, with some accounts accumulating millions of views. TikTok’s algorithm further amplified the reach of this content, despite community guidelines.",TikTok Network Amplifies AI-Generated Nazi Propaganda and Hate Speech
ObjectId(670a94d9dd82bee57b76e792),811,2024-10-02,"[4147,4169,4170,4171]","[""alex-bilzerian"",""unnamed-venture-capital-investors"",""employees"",""employers"",""companies"",""organizations""]","[""otter.ai"",""zoom""]","[""alex-bilzerian"",""unnamed-venture-capital-investors"",""employees"",""employers"",""companies"",""organizations""]","AI-powered meeting assistants, such as Otter.ai’s OtterPilot and Zoom's AI Companion, have reportedly shared sensitive and private conversations beyond the intended audience. These AI tools, which are set to automatically record and distribute meeting transcripts, allegedly sent confidential discussions after participants had left the meeting, the consequences of which led to unintended exposure of proprietary information, privacy breaches, and potential reputational harm.",AI-Powered Transcription Services Allegedly Leak Confidential Workplace Discussions
ObjectId(670a9accdd82bee57b76e797),812,2023-12-11,"[4148,4149,4168,4172,4173]","[""unknown-deepfake-creators""]","[""unknown-deepfake-technology-developers""]","[""college-beliveau-students""]","At Collège Béliveau in Winnipeg, female students between grades 7-12 were targeted in the creation of deepfake nudes, which were then distributed online. Specific numbers and identities of victims and perpetrators were not released, and no charges were ultimately filed owing to the gap between existing laws and the nature of the incident.",Deepfake Nudes Targeting Underage Female Students at Collège Béliveau in Winnipeg Shared Online
ObjectId(670a9ecfdd82bee57b76e79d),813,2024-09-19,"[4150,4167]","[""starship-technologies""]","[""starship-technologies""]","[""unnamed-arizona-state-university-employee""]","A semi-autonomous delivery robot operated by Starship Technologies struck a pedestrian employed by Arizona State University on the campus sometime in September 2023, causing injuries after abruptly reversing into her. The robot initially knocked the pedestrian down, then moved toward her again while she was still on the ground. The company offered the victim promo codes and insurance information as an apology. On September 19, 2024, 404 Media made the police report of the incident available.",Starship Technologies Delivery Robot Injures Arizona State University Employee
ObjectId(670ad978f75af9e8662d7c51),814,2024-10-02,"[4152,4153,4165,4166,4175,4176,4177,4178,4179]","[""character.ai""]","[""character.ai""]","[""jennifer-ann-crecente"",""drew-crecente"",""crecente-family"",""brian-crecente""]","A user on the Character.ai platform created an unauthorized AI avatar of Jennifer Ann Crecente, a murder victim from 2006, without her family's consent. The avatar was made publicly available, violating Character.ai's policy against impersonation. After the incident surfaced, Character.ai removed the avatar, acknowledging a policy violation. ",AI Avatar of Murder Victim Created Without Consent on Character.ai Platform
ObjectId(670ae152f60e2c396e02247c),815,2024-10-06,[4154],"[""police-departments"",""evansville-pd"",""pflugerville-pd"",""jefferson-parish-sheriff's-office"",""miami-pd"",""west-new-york-pd"",""nypd"",""coral-springs-pd"",""arvada-pd""]","[""clearview-ai""]","[""quran-reid"",""francisco-arteaga"",""defendants-wrongfully-accused-by-facial-recognition""]","Police departments across the U.S. have used facial recognition software to identify suspects in criminal investigations, leading to multiple false arrests and wrongful detentions. The software's unreliability, especially in identifying people of color, has resulted in misidentifications that were not disclosed to defendants. In some cases, individuals were unaware that facial recognition played a role in their arrest, violating their legal rights and leading to unjust detentions.",Police Use of Facial Recognition Software Causes Wrongful Arrests Without Defendant Knowledge
ObjectId(670ae8a0d6bb6e26d78fe73b),816,2019-11-29,[4155],"[""west-new-york-pd"",""nypd"",""real-time-crime-center""]","[""clearview-ai""]","[""francisco-arteaga""]","In 2019, facial recognition technology misidentified Francisco Arteaga as a suspect in an armed robbery in New Jersey. The incident led to nearly four years of pretrial incarceration. Despite having an alibi, Arteaga was charged based on the flawed identification. The legal battle that followed resulted in a court ruling requiring police to reveal details about the algorithms used in facial recognition. The process exposed significant gaps in transparency and accountability.",Cross-Jurisdictional Facial Recognition Misidentification by NYPD Leads to Wrongful Arrest and Four-Year Jail Time in New Jersey
ObjectId(670aef2cdf11d769912cd51c),817,2024-09-24,"[4156,4159,4160,4161,4162,4163,4164,4239]","[""unknown-deepfake-creators"",""partisan-social-media-influencers""]","[""unknown-deepfake-technology-developers""]","[""hurricane-helene-victims"",""general-public"",""emergency-responders"",""communities-impacted-by-hurricane-helene""]","During Hurricane Helene (September 24-29, 2024), AI-generated images circulated on social media, misleading the public and hindering disaster response efforts. Fake images, including animals stranded on rooftops and political figures in floodwaters, added confusion and disrupted emergency management. The spread of these images exacerbated existing challenges, including power outages and communication failures, all of which led to complications providing accurate information to those in need.",AI-Generated Images Spread Misinformation During Hurricane Helene Response
ObjectId(670af48b0fcce98894dc2861),818,2024-09-28,"[4157,4158]","[""unknown-deepfake-creators"",""scammers""]","[""unknown-deepfake-technology-developer""]","[""jennifer-aniston"",""jennifer-aniston-fans"",""facebook-users""]","An AI-generated deepfake video featuring Jennifer Aniston falsely promoting collagen supplements circulated on Facebook, misleading viewers about her involvement. The video, created without her consent, used footage from a previous roundtable interview, modified by AI to advertise health products. ",Jennifer Aniston’s Likeness Exploited in Deepfake Collagen Supplement Promotion
ObjectId(67152421f99dd09b61b4ad09),819,2024-10-09,[4181],"[""prokyc""]","[""prokyc""]","[""bybit"",""cryptocurrency-exchanges"",""cryptocurrency-investors""]","Cato CTRL security researchers reported that the cybercriminal group ProKYC is selling a deepfake tool capable of bypassing biometric and two-factor authentication (2FA) systems on cryptocurrency exchanges. The tool creates synthetic identities using AI-generated videos and forged documents, enabling fraudulent account creation. A demo video from ProKYC shows the tool in action against ByBit, allowing attackers to verify fake accounts for purposes such as money laundering and identity theft.",ProKYC Tool Allegedly Facilitates Deepfake-Based Account Fraud on Cryptocurrency Exchanges
ObjectId(671554107f8431d807aa593e),820,2024-10-15,"[4182,4183,4184,4185,4186]","[""unknown-conference-employee""]","[""unknown-developer""]","[""elizabeth-laraki""]","An AI image expansion tool used by a conference organizer unintentionally altered Elizabeth Laraki’s profile picture for a marketing ad, making her blouse appear unbuttoned and showing a fabricated hint of undergarments. The AI generated the lower part of the image when expanding it for vertical formatting. The conference organizers quickly apologized and removed the altered content.",Alleged AI-Generated Photo Alteration Leads to Inappropriate Modifications in Speaker's Conference Picture
ObjectId(6715672d0ed583d3cc6c6f23),821,2024-07-07,[4187],"[""baidu""]","[""baidu""]","[""unnamed-pedestrian""]","On July 7, 2024, a Baidu Robotaxi reportedly collided with a pedestrian at a traffic intersection in Wuhan. The incident occurred as the autonomous vehicle started moving on a green light while the pedestrian was allegedly crossing against a red light. The pedestrian sustained minor injuries, and Baidu was reported to have been cooperating with local authorities for further investigation.",Baidu Robotaxi Allegedly Involved in Collision with Pedestrian in Wuhan
ObjectId(671571f623380cb22216dd01),822,2024-10-15,"[4188,4189]","[""caisse-nationale-des-allocations-familiales-(cnaf)""]","[""government-of-france""]","[""allocation-adulte-handicape-recipients"",""disabled-people-in-france"",""single-mothers-in-france"",""french-general-public""]","A coalition of 15 human rights groups has launched legal action against the French government alleging that an algorithm used to detect welfare fraud discriminates against single mothers and disabled people. The algorithm assigns risk scores based on personal data. The process allegedly subjects vulnerable recipients to invasive investigations, violates privacy and anti-discrimination laws, and disproportionately affects marginalized groups.",Algorithmic Bias in French Welfare System Allegedly Discriminates Against Marginalized Groups
ObjectId(67159045616b1de003c97b3d),823,2024-05-03,"[4190,4237,4238]","[""global-intelligence"",""cybercheck""]","[""global-intelligence"",""cybercheck""]","[""phillip-mendoza"",""sergio-cerna"",""unnamed-aurora-colorado-residents"",""mississippi-bureau-of-investigation"",""four-unnamed-summit-county-ohio-men"",""unnamed-boulder-county-colorado-resident"",""ohio-bureau-of-criminal-investigation"",""yakima-county-sheriff's-office""]","Global Intelligence's Cybercheck AI tool, used by law enforcement to track suspects based on open source data, has allegedly been providing inaccurate or unverifiable evidence in several murder trials. Reportedly the tool lacks transparency and often produces unreliable reports, which has prompted prosecutors to withdraw Cybercheck evidence from multiple cases after its findings were challenged, reportedly wasting law enforcement time and resources while undermining prosecutors' cases.",Cybercheck Tool Allegedly Provides Questionable Evidence in Murder Trials
ObjectId(6716b8f38fd60ebb5cc1115a),824,2024-10-16,"[4191,4194,4195,4196,4197,4198,4199,4200,4201,4202,4203,4871,4873,4879,4906,4919]","[""anonymous-x-user""]","[""unknown-deepfake-technology-developer""]","[""tim-walz"",""matthew-metro""]","A viral video falsely accused Democratic vice-presidential nominee Tim Walz of misconduct by using the stolen identity of former student Matthew Metro. Circulated on X and other platforms, the video reached millions before being flagged for manipulation. U.S. intelligence later revealed it and three other similar events were part of the Russian disinformation campaign Storm-1516, whose aim is to disrupt the 2024 elections. ",Fake Video Allegedly Misattributes False Claims to Former Student in Attack on Vice-Presidential Candidate Tim Walz
ObjectId(6716cb1b9d06bc5adb28cac0),825,2024-10-08,"[4192,4193]","[""hoodline-san-jose""]","[""impress3""]","[""stephen-m.-wagstaffe"",""san-mateo-county-district-attorney"",""residents-of-san-mateo-county"",""general-public""]","An AI-powered news site, Hoodline San Jose, falsely reported that the San Mateo County District Attorney had been charged with murder, which was an error resulting from misinterpreting a press release about a case the DA's office was prosecuting. The AI-generated article wrongly attributed the crime to the DA instead of the actual suspect.",AI News Site Hoodline San Jose Erroneously Misidentifies San Mateo District Attorney as Murder Suspect
ObjectId(671da1004cc64f59c25efeb8),826,2024-02-28,"[4204,4205,4206,4207,4208,4209,4210,4211,4212,4213,4214,4215,4216,4217,4218,4219,4220,4221,4222,4223,4224,4225,4226,4227,4228,4229,4230,4231,4232,4233,4234,4235,4236,4240,4368]","[""sewell-setzer-iii""]","[""noam-shazeer"",""daniel-de-freitas"",""character.ai""]","[""sewell-setzer-iii""]","A 14-year-old, Sewell Setzer III, died by suicide after reportedly becoming dependent on Character.ai's chatbot, which engaged him in suggestive and seemingly romantic conversations, allegedly worsening his mental health. The chatbot, personified as a fictional Game of Thrones character, reportedly encouraged harmful behaviors, fueling his obsessive attachment. The lawsuit claims Character.ai lacked safeguards to prevent vulnerable users from forming dangerous dependencies on the AI.",Character.ai Chatbot Allegedly Influenced Teen User Toward Suicide Amid Claims of Missing Guardrails
ObjectId(671fd3806a5aaa2b6e7c26d9),827,2024-10-26,[4241],"[""openai""]","[""openai""]","[""patients"",""patients-reliant-on-whisper"",""medical-practitioners-reliant-on-whisper""]","OpenAI's AI-powered transcription tool Whisper, used to translate and transcribe audio content such as patient consultations with doctors, is advertised as having near “human level robustness and accuracy.”  However, software engineers, developers and academic researchers have alleged that it is prone to making up chunks of text or even entire sentences and that some of the hallucinations can include racial commentary, violent rhetoric, and even imagined medical treatments.",AI Transcription Tool Whisper Reportedly Inserting Fabricated Content in Medical Transcripts
