ObjectId(630c86a4707bde9384fd94ee),312,2021-08-15,"[1963,1964,1965,1966]","[""sanas""]","[""sanas""]","[""call-center-agents-having-non-midwestern-american-accent"",""people-having-non-midwestern-american-accent""]","A startup’s use of AI voice technology to alter or remove accents for call center agents was scrutinized by critics as reaffirming bias, despite the company’s claim.",Startup's Accent Translation AI Denounced as Reinforcing Racial Bias
ObjectId(630ca22388619542799c19ec),316,2016-06-02,[1971],"[""facebook""]","[""facebook""]","[""facebook-users""]","Facebook’s advertisement-approval algorithm was reported by a security analyst to have neglected simple checks for domain URLs, leaving its users at risk of fraudulent ads.",Facebook Ad-Approval Algorithm Allegedly Missed Fraudulent Ads via Simple URL Checks
ObjectId(62f4c81b0658670483dbe51b),288,2019-01-30,"[1895,1896,2025,2026]","[""woodbridge-police-department""]","[""unknown""]","[""nijeer-parks""]","Woodbridge Police Department falsely arrested an innocent Black man following a misidentification by their facial recognition software, who was jailed for more than a week and paid thousands of dollar for his defense.",New Jersey Police Wrongful Arrested Innocent Black Man via FRT
ObjectId(62f4d2aa4a3f91af3dd48640),289,2020-06-15,"[1897,1898]","[""starship-technologies""]","[""starship-technologies""]","[""jisuk-mok"",""frisco-residents""]","A Starship food delivery robot crashed into the front bumper of a vehicle waiting at a stoplight intersection in Frisco, Texas, the video of which the company reportedly refused to release.","Starship Delivery Robot Scuffed Bumper of a Resident’s Car in Texas, Allegedly Refusing to Release Footage of the Accident"
ObjectId(63048a1b3359229b334cee96),306,2016-05-26,"[1946,1948,1949]","[""tesla""]","[""tesla""]","[""unnamed-tesla-owner"",""tesla-drivers""]","A Tesla Model S operating on the Traffic-Aware Cruise Control (TACC) feature of Autopilot was shown on video by its driver crashing into a parked van on a European highway in heavy traffic, which damaged the front of the car.",Tesla on Autopilot TACC Crashed into Van on European Highway
ObjectId(633c45fd399f7471b597a758),345,2021-04-13,[2058],"[""insurance-companies""]","[""ccc-information-services"",""tractable""]","[""vehicle-repair-shops"",""vehicle-owners""]","Auto-insurance companies' photo-based estimation of repair price was alleged by repair shop owners and industry groups as providing inaccurate estimates, causing damaged cars to stay in the shop longer.",Auto-Insurance Photo-Based Estimation Allegedly Gave Inaccurate Repair Prices Frequently
ObjectId(630349169b0efe36c58855ab),301,2022-02-15,[1938],"[""broward-college""]","[""honorlock""]","[""unnamed-florida-teenager""]",Broward College’s use of remote proctoring system and reliance on its flagging algorithm allegedly led to a wrongful accusation of academic dishonesty in a biology exam of a Florida teenager.,Teenager at Broward College Allegedly Wrongfully Accused of Cheating via Remote Proctoring
ObjectId(630c923888619542799a0c42),314,2022-08-17,[1968],"[""stability-ai""]","[""stability-ai"",""runway"",""laion"",""eleutherai"",""compvis-lmu""]","[""stability-ai"",""deepfaked-celebrities""]","Stable Diffusion, an open-source image generation model by Stability AI, was reportedly leaked on 4chan prior to its release date, and was used by its users to generate pornographic deepfakes of celebrities.",Stable Diffusion Abused by 4chan Users to Deepfake Celebrity Porn
ObjectId(630f18e003b40739e3f018e6),322,2019-12-07,"[1991,1994]","[""tesla""]","[""tesla""]","[""connecticut-state-police""]","A Tesla Model 3 on Autopilot slammed into a parked car of patrol police officers who stopped to assist a stranded motorist on the interstate in Norwalk, Connecticut.",Tesla Model 3 Crashed into Police Patrol Car on Connecticut Highway
ObjectId(633423b68b9212a310a337bc),336,2015-03-01,"[2048,2119,2120,2121]","[""uk-home-office""]","[""uk-home-office""]","[""uk-immigrant-newlyweds""]","UK Home Office's opaque algorithm to detect sham marriages flagged some nationalities for investigation more than others, raising fears surrounding discrimination based on nationality and age.",UK Home Office's Sham Marriage Detection Algorithm Reportedly Flagged Certain Nationalities Disproportionately
ObjectId(63428c5563b61b7fa042db22),351,2022-09-13,[2068],"[""@tengazillioiniq""]","[""unknown""]","[""halle-bailey"",""black-actresses""]","A Twitter user reportedly modified using generative AI a short clip of Disney's 2022 version of ""The Little Mermaid,"" replacing a Black actress with a white digital character.","""The Little Mermaid"" Clip Doctored Using Generative AI to Replace Black Actress with White Character"
ObjectId(6347c85bf149ac829bebe6ac),364,2020-04-15,[2131],"[""walmart""]","[""everseen""]","[""walmart-employees""]",Walmart's theft-deterring bagging-detection system allegedly exposed workers to health risks during the coronavirus pandemic when its false positives prompted workers to unnecessarily step in to resolve the issue.,Walmart's Bagging-Detection False Positives Exposed Workers to Health Risk
ObjectId(6347d11ef149ac829beda3a3),367,2020-06-17,[2150],"[""openai"",""google""]","[""openai"",""google""]","[""gender-minority-groups"",""racial-minority-groups"",""underrepresented-groups-in-training-data""]","Unsupervised image generation models trained using Internet images such as iGPT and SimCLR were shown to have embedded racial, gender, and intersectional biases, resulting in stereotypical depictions.","iGPT, SimCLR Learned Biased Associations from Internet Training Data"
ObjectId(63429a302acc51f55c0d97ad),355,2018-07-07,"[2081,2082,2083,2903,2972]","[""uber""]","[""uber""]","[""uber-drivers""]","Uber was alleged in a lawsuit to have wrongfully accused its drivers in the UK and Portugal of fraudulent activity through automated systems, which resulted in their dismissal without a right to appeal.",Uber Allegedly Wrongfully Accused Drivers of Fraud via Automated Systems
ObjectId(63429b21c5ced0d56b1f9725),356,2020-09-15,"[2084,2085]","[""murat-ayfer""]","[""murat-ayfer"",""openai""]","[""historically-disadvantaged-groups""]",Philosopher AI as built on top of GPT-3 was reported by its users for having strong tendencies to produce offensive results when given prompts on certain topics such as feminism and Ethiopia.,Philosophy AI Tentatively Produced Offensive Results for Certain Prompts
ObjectId(6347dbceed247984c90d6b27),368,2016-06-01,"[2151,2152,2153,2154,2155,2156,2157,2159,2160,2161]","[""the-israel-military""]","[""anyvision""]","[""palestinians-residing-in-the-west-bank""]","A controversial surveillance program involving facial recognition and algorithmic recommendation, Blue Wolf, was deployed by the Israeli military to monitor Palestinians in the West Bank.","Facial Recognition Smart Phone App ""Blue Wolf"" Monitored Palestinians in West Bank"
ObjectId(634d1f8f7448b116a2eba9cf),370,2017-09-27,[2163],"[""google""]","[""google""]","[""google's-competitor-shopping-services""]","Google was fined by EU Commission for changing its shopping algorithms in Europe to favor its own comparison service over competitors, resulting in anti-competitive effects.",Google Fined for Changing Shopping Algorithms in EU to Favor Own Service
ObjectId(635f0120e6a5db6da1d3a483),378,2022-04-06,"[2175,2176]","[""tusimple""]","[""tusimple""]","[""tusimple"",""state-of-arizona""]",A TuSimple autonomous truck operating with backup drivers behind the wheel operated on an outdated command sequence and suddenly veered into the center divide on the interstate freeway.,TuSimple Truck Steered into Interstate Freeway Divide
ObjectId(636dffb0411dcebbcc969fd5),391,2022-07-26,"[2244,2246]","[""southern-co-op""]","[""hikvision""]","[""souther-co-op-customers""]","Southern Co-op's use of facial recognition reportedly to curb violent crime in UK supermarkets was alleged by civil society and privacy groups as ""unlawful"" and ""complete"" invasion of privacy.",Facial Recognition Trial by UK Southern Co-op Alleged as Unlawful
ObjectId(6356adfd642a3e49ac4c13a9),371,2019-11-29,"[2167,2184,2203]","[""ugandan-government""]","[""huawei""]","[""political-opposition-in-uganda""]","Huawei's AI systems involving facial recognition were reportedly deployed by the Ugandan government to monitor political opposition actors and anti-regime sentiments, which raised fears of surveillance and suppression of individual freedoms.",Uganda Deployed Huawei's Facial Recognition to Monitor Political Opposition and Protests
ObjectId(636e0f5e0a00a4f89b1146a3),393,2021-12-08,[2247],"[""facebook""]","[""facebook""]","[""facebook-users-speaking-swahili"",""facebook-users-speaking-english"",""facebook-users""]",Facebook's ad moderation system involving algorithms failed to flag hateful language and violating content such as calls for killings for ads in English and Swahili.,Facebook AI-Supported Moderation for Ads Failed to Detect Violating Content
ObjectId(63429c05ad13a1c2fb5b52a1),358,2018-06-01,[2089],"[""cadillac-fairview""]","[""unknown""]","[""chinook-centre-mall-goers"",""market-mall-goers""]","Facial recognition (FRT) was reportedly deployed in some Calgary-area malls to approximate customer age and gender without explicit consent, which a privacy expert warned was a cause for concern.",Calgary Malls Deployed Facial Recognition without Customer Consent
ObjectId(6347c81eb55a37b65883b48c),363,2021-01-15,[2130],"[""facebook""]","[""facebook""]","[""facebook-users-posting-about-plymouth-hoe"",""facebook-users-in-plymouth-hoe"",""plymouth-hoe-residents""]",Facebook's automated system mistakenly labelled posts featuring the seafaring landmark Plymouth Hoe as misogynistic.,Facebook's Automated Moderation Mistakenly Flagged Landmark's Name as Offensive
ObjectId(634d1c221ad286865cf8d200),369,2022-08-29,[2162],"[""jason-allen""]","[""midjourney""]","[""artists-submitting-in-the-digital-arts-category"",""digital-artists"",""artists""]","An artwork generated using generative AI won first place in the digital arts category of the Colorado State Fair's art competition, which raised concerns surrounding labor displacement and unfair competition.",GAN Artwork Won First Place at State Fair Competition
ObjectId(637e37b4f569208079ed32e7),400,2022-02-23,[2273],"[""google""]","[""google""]","[""women-in-need-of-abortion-services"",""women-having-unexpected-or-crisis-pregnancies""]","Google Search reportedly returned fewer abortion clinics for searches from poorer and rural areas, particularly ones with Targeted Regulation of Abortion Providers (TRAP) laws.",Google Search Returned Fewer Results for Abortion Services in Rural Areas
ObjectId(635780b830a3a8f1ece4a18d),373,2013-10-01,"[2169,2187,2188,2189,2190,2191,2213,2214,2215,2216,2238,2798,4849,4850]","[""michigan-unemployment-insurance-agency""]","[""fast-enterprises"",""csg-government-solutions""]","[""unemployed-michigan-residents-falsely-accused-of-fraud"",""michigan-residents-who-faced-bankruptcy-or-foreclosure-due-to-midas""]","Michigan’s MiDAS system falsely accused over 34,000 people of unemployment fraud from 2013 to 2015, which reportedly caused financial ruin for many. The automated system was designed to cut costs, but it adjudicated fraud cases without human oversight. That led to an 85% error rate. Victims faced wage garnishments, some lost homes, and some faced bankruptcy. Despite early warnings, Michigan’s UIA defended MiDAS until lawsuits and federal pressure forced reforms. Legislators have been seeking compensation for those wrongfully accused.",Michigan's Unemployment Benefits Algorithm MiDAS Issued False Fraud Claims to Thousands of People
ObjectId(6357a047b7c906438c20d050),376,2016-09-01,"[2172,2185,2186,2261,2281,4445,4446,4447,4448,4449,4471,4479,4480,4481]","[""realpage""]","[""thoma-bravo"",""realpage"",""jeffrey-roper""]","[""renters""]","RealPage’s YieldStar pricing algorithm is at the center of allegations that it enabled landlords to coordinate rent increases by sharing nonpublic pricing and occupancy data, raising rents artificially and reducing competition. On January 7, 2025, the U.S. Department of Justice filed an antitrust lawsuit against six major landlords, alleging that they used the algorithm and other direct communication methods to stifle competition, harming renters nationwide.",RealPage Algorithm Allegedly Inflates Rents and Reduces Competition in Housing Market
ObjectId(6371fabca346c979b1ae42cf),395,2021-03-02,"[2254,2255,2256,2257]","[""amazon""]","[""netradyne""]","[""amazon-delivery-drivers""]","Amazon delivery drivers were forced to consent to algorithmic collection and processing of their location, movement, and biometric data through AI-powered cameras, or be dismissed.",Amazon Forced Deployment of AI-Powered Cameras on Delivery Drivers
ObjectId(6347c501dcc7f82dbe8893d5),361,2018-05-11,[2111],"[""amazon""]","[""amazon""]","[""danielle's-family"",""amazon-echo-users""]",Amazon Echo misinterpreted a background conversation between a husband and wife as instructions for recording a message and sending it to one of the husband's employees.,Amazon Echo Mistakenly Recorded and Sent Private Conversation to Random Contact
ObjectId(635c5c81de6aa8bda90be620),377,2022-10-11,[2174],"[""weibo""]","[""weibo""]","[""weibo"",""chinese-government""]",Weibo's user moderation model is having difficulty keeping up with shifting user slang in defiance of Chinese state censors.,Weibo Model Had Difficulty Detecting Shifts in Censored Speech
ObjectId(634299bc63b61b7fa0444163),354,2020-06-20,"[2078,2079,2080,2904,2903]","[""uber""]","[""uber""]","[""uber-drivers""]","Uber was alleged in a lawsuit to have provided incomplete notice about automated decision-making and profiling for drivers such as information about their driving behavior, and use of phone.",Uber Allegedly Violated GDPR by Failing to Provide Sufficient Notice on Automated Profiling for Drivers
ObjectId(63621e63de6aa8bda92f9f24),381,2020-10-29,[2217],"[""sit-acronis-autonomous""]","[""sit-acronis-autonomous""]","[""sit-acronis-autonomous""]",An autonomous Roborace car drove itself into a wall in round one of the Season Beta 1.1 race.,Autonomous Roborace Car Drove Directly into a Wall
ObjectId(6342970863b61b7fa043f53e),353,2019-03-01,"[2073,2074,2195,2196]","[""tesla""]","[""tesla""]","[""jeremy-banner"",""jeremy-banner's-family""]","A Tesla Model 3 driver switched on Autopilot seconds before the crash into the underbelly of a tractor-trailer on a highway in Florida, killing the Tesla driver.","Tesla on Autopilot Crashed into Trailer Truck in Florida, Killing Driver"
ObjectId(6357844d24cf9385ce69f63f),374,2020-08-13,"[2170,2206,2207,2208,2209,2210,2211,2212]","[""uk-office-of-qualifications-and-examinations-regulation""]","[""uk-office-of-qualifications-and-examinations-regulation""]","[""a-level-pupils"",""gcse-pupils"",""pupils-in-state-schools"",""underprivileged-pupils""]","UK Office of Qualifications and Examinations Regulation (Ofqual)'s grade-standardization algorithm providing predicted grades for A level and GCSE qualifications in the UK, Wales, Northern Ireland, and Scotland was reportedly giving grades lower than teachers' assessments, and disproportionately for state schools.",UK Ofqual's Algorithm Disproportionately Provided Lower Grades Than Teachers' Assessments
ObjectId(636218ea6a07890c6a6ea2e6),380,2014-03-04,"[2181,2182,2258,2259,2260]","[""facebook""]","[""facebook""]","[""jewish-people""]","Facebook's automated advertising categories generated using users' declared interests contained anti-Semitic categories such as ""Jew hater""  and ""How to burn Jews"" which were listed as fields of study.",Facebook's Auto-Generated Targeting Ad Categories Contained Anti-Semitic Options
ObjectId(63429b73fb9dbe61e441cf9e),357,2019-02-14,"[2086,2087,2088]","[""openai""]","[""openai""]","[""openai"",""people-having-personal-data-in-gpt-2's-training-data""]","OpenAI's GPT-2 reportedly memorized and could regurgitate verbatim instances of training data, including personally identifiable information such as names, emails, twitter handles, and phone numbers.",GPT-2 Able to Recite PII in Training Data
ObjectId(63627328a7be79b265325ac3),385,2022-10-04,"[2224,2225,2231,2232,2233,2234]","[""edmonton-police-service""]","[""parabon-nanolabs""]","[""black-residents-in-edmonton""]","The Edmonton Police Service (EPS) in Canada released a facial image of a Black male suspect generated by an algorithm using DNA phenotyping, which was denounced by the local community as racial profiling.",Canadian Police's Release of Suspect's AI-Generated Facial Photo Reportedly Reinforced Racial Profiling
ObjectId(636b524b23e1c9d9beea48b5),388,2018-12-01,[2235],"[""the-government-in-bahia"",""bahia's-secretary-of-public-security""]","[""huawei""]","[""black-people-in-brazil"",""black-people-in-bahia""]",Facial recognition deployed in a pilot project by the local government of Bahia despite having minimal hit rate reportedly targeted Black and poor people disproportionately.,Facial Recognition Pilot in Bahia Reportedly Targeted Black and Poor People
ObjectId(6362264aa7be79b2651b6a2d),383,2022-10-04,"[2220,2223]","[""google-home""]","[""google-home""]","[""black-google-home-mini-users"",""google-home-mini-users""]",Google Home Mini speaker was reported by users for announcing aloud the previously-censored n-word in a song title.,Google Home Mini Speaker Reportedly Read N-Word in Song Title Aloud
ObjectId(636dfa2e1b6ec4ae9b2296e0),390,2022-06-28,[2243],"[""unknown""]","[""unknown""]","[""interviewers-of-remote-work-positions"",""employers-of-remote-work-positions""]",Voice and video deepfakes were reported by FBI Internet Crime Complaint Center (IC3) in complaint reports to have been deployed during online interviews of the candidates for remote-work positions.,Deepfakes Reportedly Deployed in Online Interviews for Remote Work Positions
ObjectId(636b4ae550d21acd7f9d55c6),387,2014-12-22,[2229],"[""oracle""]","[""oracle""]","[""internet-users""]",Oracle's automated system involving algorithmic data processing was alleged in a lawsuit to have been unlawfully collecting personal data from millions of people and violating their privacy rights.,Oracle's Algorithmic Data Processing System Alleged as Unlawful and Violating Privacy Rights
ObjectId(636e237be4c942942295944c),394,2017-03-15,"[2248,2251]","[""youtube"",""twitch"",""tiktok"",""instagram""]","[""youtube"",""twitch"",""tiktok"",""instagram""]","[""youtube-content-creators"",""twitch-content-creators"",""tiktok-content-creators"",""instagram-content-creators""]","TikTok's, YouTube's, Instagram's, and Twitch's use of algorithms to flag certain words devoid of context changed content creators' use of everyday language or discussion about certain topics in fear of their content getting flagged or auto-demonetized by mistake.",Social Media's Automated Word-Flagging without Context Shifted Content Creators' Language Use
ObjectId(6347c800f149ac829bebd5f0),362,2021-07-20,[2129],"[""facebook""]","[""facebook""]","[""wny-gardeners"",""gardening-facebook-groups"",""facebook-users-in-gardening-groups""]","Facebook's automated system flagged gardening groups' use of ""hoe"" and violent language against bugs as a violation by mistake.",Facebook's Automated Moderation Flagged Gardening Group's Language Use by Mistake
ObjectId(63622d23f8424658ecc55ba7),384,2022-10-03,"[2221,2222]","[""glovo""]","[""glovo""]","[""sebastian-galassi"",""sebastian-galassi's-family""]","Delivery company Glovo's automated system sent an email terminating an employee for ""non-compliance terms and conditions"" after the employee was killed in a car accident while making a delivery on Glovo's behalf.",Glovo Driver in Italy Fired via Automated Email after Being Killed in Accident
ObjectId(6347bf83b3a025aa31ca107d),359,2021-05-23,[2097],"[""facebook"",""instagram"",""twitter""]","[""facebook"",""instagram"",""twitter""]","[""palestinian-social-media-users"",""facebook-users"",""instagram-users"",""twitter-users"",""facebook-employees-having-families-affected-by-the-conflict""]","Facebook, Instagram, and Twitter wrongly blocked or restricted millions of pro-Palestinian posts and accounts related to the Israeli-Palestinian conflict, citing errors in their automated content moderation system.","Facebook, Instagram, and Twitter Cited Errors in Automated Systems as Cause for Blocking pro-Palestinian Content on Israeli-Palestinian Conflict"
ObjectId(63729e404a5eff12b1d019b7),396,2018-07-04,[2263],"[""uber""]","[""uber""]","[""transgender-uber-drivers""]",Transgender Uber drivers reported being automatically deactivated from the app due to Real-Time ID Check failing to account for difference in appearance of people undergoing gender transitions.,Transgender Uber Drivers Mistakenly Kicked off App for Appearance Change during Gender Transitions
ObjectId(6342917fb710d4e33cf416e9),352,2022-09-15,"[2070,2076,2093,2426]","[""stephan-de-vries""]","[""openai"",""stephan-de-vries""]","[""stephan-de-vries""]",Remoteli.io's GPT-3-based Twitter bot was shown being hijacked by Twitter users who redirected it to repeat or generate any phrases.,GPT-3-Based Twitter Bot Hijacked Using Prompt Injection Attacks
ObjectId(635769bd84468db9632cd98c),372,2022-07-22,"[2168,2177,2178]","[""google""]","[""google""]","[""google-pixel-6a-users""]","Google Pixel 6a's fingerprint recognition feature was reported by users for security issues, in which phones were mistakenly unlocked by unregistered fingerprints.",Users Reported Security Issues with Google Pixel 6a's Fingerprint Unlocking
ObjectId(635794898e87db52ebfb01c5),375,2019-09-29,"[2171,2192,2193]","[""krungthai-bank""]","[""krungthai-bank""]","[""thai-citizens"",""elder-thai-citizens""]","A Thai wallet app failed to recognize people’s faces, resulting in citizens and disproportionately elders unable to sign up for Thai government’s cash handout and co-pay programs or having to wait in long queues at local ATMs for authentication.",Thai Wallet App's Facial Recognition Errors Created Registration Issues for Government Programs
ObjectId(636218985a33233a22f6632e),379,1992-05-25,"[2179,2180]","[""pepsi""]","[""d.g.-consultores""]","[""filipinos""]","Pepsi's number generation system determining daily winners in its Number Fever promotion in the Philippines mistakenly produced a number held by thousands which resulted in riots, deaths, conspiracy theories, and decades of lawsuits.",Error in Pepsi's Number Generation System Led to Decades-Long Damages in the Philippines
ObjectId(6362229cf2f56bc79407bf96),382,2017-11-21,[2219],"[""instagram""]","[""instagram""]","[""molly-rose-russell"",""the-russell-family"",""teenage-girls"",""teenagers""]","Instagram was ruled by a judge to have contributed to the death of a teenage girl in the UK allegedly through its exposure and recommendation of suicide, self-harm, and depressive content.",Instagram's Exposure of Harmful Content Contributed to Teenage Girl’s Suicide
ObjectId(63627e3fe6a5db6da1a32ac6),386,2019-07-03,"[2227,2228,2252]","[""amazon""]","[""amazon""]","[""amazon-warehouse-workers""]","Amazon’s warehouse worker “time off task"" (TOT) tracking system was used to discipline and dismiss workers, falsely assuming workers to have wasted time and failing to account for breaks or equipment issues.","Amazon’s ""Time Off Task"" System Made False Assumptions about Workers' Time Management"
ObjectId(636b5e9802006dadfd7b75df),389,2022-04-05,"[2239,2240,2562,3182]","[""cruise""]","[""cruise""]","[""san-francisco-firefighters"",""san-francisco-fire-department""]",A fire truck in San Francisco responding to a fire was blocked from passing a doubled-parked garbage truck by a self-driving Cruise car on the opposing lane which stayed put and did not reverse to clear the lane.,Cruise Autonomous Car Blocked Fire Truck Responding to Emergency
ObjectId(637338f62f19ca2c3763fd78),397,2022-09-11,"[2264,2268]","[""tiktok""]","[""tiktok""]","[""young-tiktok-users"",""tiktok-users"",""gen-z-tiktok-users""]",TikTok's search recommendations reportedly contained misinformation about political topics bypassing both AI and human content moderation.,Misinformation Reported in TikTok's Search Results Despite Moderation by AI and Human
ObjectId(6373414f2f19ca2c37674860),398,2022-08-15,"[2265,2266,2267]","[""tesla""]","[""tesla""]","[""tesla-drivers"",""horse-drawn-carriages""]","Tesla Autopilot's computer vision system was shown in a video mistaking a horse-drawn carriage for other forms of transport such as a truck, a car, and a human following a car.",Tesla Autopilot Misidentified On-Road Horse-Drawn Carriage
ObjectId(637b0fb0dc7613ede0f49fb0),399,2022-11-15,"[2270,2271,2272]","[""meta-ai"",""meta"",""facebook""]","[""meta-ai"",""meta"",""facebook""]","[""minority-groups"",""meta-ai"",""meta"",""facebook"",""minority-groups""]",Meta AI trained and hosted a scientific paper generator that sometimes produced bad science and prohibited queries on topics and groups that are likely to produce offensive or harmful content.,Meta AI's Scientific Paper Generator Reportedly Produced Inaccurate and Harmful Content
ObjectId(637f9bfc34f2d7279c03dad8),401,2021-06-03,"[2275,2278,2279,2280]","[""google""]","[""google""]","[""the-karnataka-government"",""kannada-speakers""]","Google's knowledge-graph-powered algorithm showed Kannada in its featured Answer Box when prompted ""ugliest language in India,"" causing outrage from Kannada-speaking people and government.","Kannada Insulted by Google's Featured Answer as ""Ugliest Language in India"""
