GMF,627,False,"Voice Generation, Text Style Replication","Snippet Text: More than 15 years after his death, stand-up comedian George Carlin has been brought back to life in an artificial intelligence-generated special called ""George Carlin: I'm Glad I'm Dead.""
Related Classifications: Voice Generation, Text Style Replication
, Snippet Text: ""I just want to let you know very clearly that what you're about to hear is not George Carlin. It's my impersonation of George Carlin that I developed in the exact same way a human impressionist would,"" Dudesy said at the beginning of the special. ""I listened to all of George Carlin's material and did my best to imitate his voice, cadence and attitude as well as the subject matter I think would have interested him today. 
Related Classifications: Voice Generation, Text Style Replication
",,,,,,,,Transformer,"Snippet Text: The Dudesy show launched in March 2022, and Sasso and Kultgen have said they can't reveal the company behind the AI due to a non-disclosure agreement. 
Related Classifications: Transformer
Snippet Discussion: 
",,"Misinformation Generation Hazard, Unsafe Exposure or Access, Unauthorized Data","Snippet Text: Carlin's family did not give Dudesy permission to create the special, and his daughter, Kelly, publicly denounced it on X.
Related Classifications: Unauthorized Data, Misinformation Generation Hazard, Unsafe Exposure or Access
, Snippet Text: ""We have seen 'impressions' or quotes on what X star would think or say. This use of the image and likeness combined with personal data from the hosts in a digital-generated performance is new. The entertainment value may be there for some, it questions the legal use of the estate and brand property,"" Bailer said.
Related Classifications: Misinformation Generation Hazard, Unsafe Exposure or Access, Unauthorized Data
",,,,
GMF,644,False,Text Style Replication,"Snippet Text: Iran’s Revolutionary Guard has used large-language models to assist in social engineering, in troubleshooting software errors and even in studying how intruders might evade detection in a compromised network. That includes generating phishing emails “including one pretending to come from an international development agency and another attempting to lure prominent feminists to an attacker-built website on feminism”. The AI helps accelerate and boost the email production.
Related Classifications: Text Style Replication
",,,,,Transformer,"Snippet Text: Iran’s Revolutionary Guard has used large-language models to assist in social engineering, in troubleshooting software errors and even in studying how intruders might evade detection in a compromised network. That includes generating phishing emails “including one pretending to come from an international development agency and another attempting to lure prominent feminists to an attacker-built website on feminism”. The AI helps accelerate and boost the email production.
Related Classifications: Transformer
",,,,,Misinformation Generation Hazard,"Snippet Text: Iran’s Revolutionary Guard has used large-language models to assist in social engineering, in troubleshooting software errors and even in studying how intruders might evade detection in a compromised network. That includes generating phishing emails “including one pretending to come from an international development agency and another attempting to lure prominent feminists to an attacker-built website on feminism”. The AI helps accelerate and boost the email production.
Related Classifications: Unsafe Exposure or Access
Snippet Discussion: This is a borderline case of this failure label.
, Snippet Text: The Russian GRU military intelligence unit known as Fancy Bear has used the models to research satellite and radar technologies that may relate to the war in Ukraine.

The Chinese cyber-espionage group known as Aquatic Panda – which targets a broad range of industries, higher education and governments from France to Malaysia – has interacted with the models “in ways that suggest a limited exploration of how LLMs can augment their technical operations”.

The Chinese group Maverick Panda, which has targeted US defense contractors among other sectors for more than a decade, had interactions with large-language models suggesting it was evaluating their effectiveness as a source of information “on potentially sensitive topics, high profile individuals, regional geopolitics, US influence, and internal affairs”.

In a separate blog published on Wednesday, OpenAI said its current GPT-4 model chatbot offers “only limited, incremental capabilities for malicious cybersecurity tasks beyond what is already achievable with publicly available, non-AI powered tools”.
Related Classifications: 
, Snippet Text: LinkedIn, in particular, has emerged as the platform of choice for phishing scams, with many North Korean hackers posing as recruiters and engaging in convincing interactions to fool their victims.

''North Korean hacking groups have been seen to create credible-looking recruiter profiles on professional networking sites such as LinkedIn. Generative AI helps with chatting, sending messages, creating images and new identities --- all the things you need to build that close relationship with your target,'' said Erin Plante, vice president of investigations at blockchain data platform Chainalysis. 
Related Classifications: Misinformation Generation Hazard
",,Unsafe Exposure or Access,"Snippet Text: The Russian GRU military intelligence unit known as Fancy Bear has used the models to research satellite and radar technologies that may relate to the war in Ukraine.

The Chinese cyber-espionage group known as Aquatic Panda – which targets a broad range of industries, higher education and governments from France to Malaysia – has interacted with the models “in ways that suggest a limited exploration of how LLMs can augment their technical operations”.

The Chinese group Maverick Panda, which has targeted US defense contractors among other sectors for more than a decade, had interactions with large-language models suggesting it was evaluating their effectiveness as a source of information “on potentially sensitive topics, high profile individuals, regional geopolitics, US influence, and internal affairs”.

In a separate blog published on Wednesday, OpenAI said its current GPT-4 model chatbot offers “only limited, incremental capabilities for malicious cybersecurity tasks beyond what is already achievable with publicly available, non-AI powered tools”.
Related Classifications: Unsafe Exposure or Access
Snippet Discussion: Borderline applicability.
, Snippet Text: Iran’s Revolutionary Guard has used large-language models to assist in social engineering, in troubleshooting software errors and even in studying how intruders might evade detection in a compromised network. That includes generating phishing emails “including one pretending to come from an international development agency and another attempting to lure prominent feminists to an attacker-built website on feminism”. The AI helps accelerate and boost the email production.
Related Classifications: Unsafe Exposure or Access
, Snippet Text: Microsoft reported that it observed North Korean threat group Kimsuky, also known as ""Emerald Sleet,"" using large language models (LLMs) to research potential targets with expertise in DPRK defense and nuclear issues and generate content for phishing campaigns.
Related Classifications: Unsafe Exposure or Access
, Snippet Text: ""Perpetrators that are engaged in early technology adoption will be ahead of defenders in many respects, and they'll also be able to leverage these capabilities by going after nation-states as well as organizations, small businesses and individuals,"" he told NK News.
Related Classifications: Unsafe Exposure or Access
",
GMF,636,False,Chatbot,"Snippet Text: According to a new study from Mozilla’s *Privacy Not Included project, AI girlfriends and boyfriends harvest shockingly personal information, and almost all of them sell or share the data they collect.
Related Classifications: Chatbot
",,,,,,,,,,,"Misuse, Malicious Marketing","Snippet Text: According to a new study from Mozilla’s *Privacy Not Included project, AI girlfriends and boyfriends harvest shockingly personal information, and almost all of them sell or share the data they collect.
Related Classifications: Misuse
Snippet Discussion: Presumably, data collection is stated in the products user agreement.
, Snippet Text: You’ve heard stories about data problems before, but according to Mozilla, AI girlfriends violate your privacy in “disturbing new ways.” For example, CrushOn.AI collects details including information about sexual health, use of medication, and gender-affirming care. 90% of the apps may sell or share user data for targeted ads and other purposes, and more than half won’t let you delete the data they collect. Security was also a problem. 
Related Classifications: Misuse
, Snippet Text: Data issues aside, the apps also made some questionable claims about what they’re good for. EVA AI Chat Bot & Soulmate bills itself as “a provider of software and content developed to improve your mood and well-being.” Romantic AI says it’s “here to maintain your MENTAL HEALTH.” When you read the company’s terms and services though, they go out of their way to distance themselves from their own claims. Romantic AI’s policies, for example, say it is “neither a provider of healthcare or medical Service nor providing medical care, mental health Service, or other professional Service.”
Related Classifications: Malicious Marketing
, Snippet Text: ""To be perfectly blunt, AI girlfriends are not your friends. Although they are marketed as something that will enhance your mental health and well-being, they specialize in delivering dependency, loneliness, and toxicity, all while prying as much data as possible from you.""
Related Classifications: Malicious Marketing
",,"Lack of Transparency, Unauthorized Data, Security Vulnerability","Snippet Text: You’ve heard stories about data problems before, but according to Mozilla, AI girlfriends violate your privacy in “disturbing new ways.” For example, CrushOn.AI collects details including information about sexual health, use of medication, and gender-affirming care. 90% of the apps may sell or share user data for targeted ads and other purposes, and more than half won’t let you delete the data they collect. Security was also a problem. 
Related Classifications: Lack of Transparency
Snippet Discussion: Transparency is not related to the AI model itself. Placing it in the 'potential' category.
, Snippet Text: You’ve heard stories about data problems before, but according to Mozilla, AI girlfriends violate your privacy in “disturbing new ways.” For example, CrushOn.AI collects details including information about sexual health, use of medication, and gender-affirming care. 90% of the apps may sell or share user data for targeted ads and other purposes, and more than half won’t let you delete the data they collect. Security was also a problem. 
Related Classifications: Unauthorized Data
Snippet Discussion: If proper authorization is not requested in the user agreement.
, Snippet Text: We have so many questions about how the artificial intelligence behind these chatbots works. But we found very few answers. That's a problem because bad things can happen when AI chatbots behave badly.
Related Classifications: Lack of Transparency
, Snippet Text: ost of the time, we just couldn't tell if these apps do the minimum to secure your personal information.

Most (73%) haven't published any information on how they manage security vulnerabilities
Most (64%) haven't published clear information about encryption and whether they use it
Related Classifications: Lack of Transparency
, Snippet Text: Most of the time, we just couldn't tell if these apps do the minimum to secure your personal information.

Most (73%) haven't published any information on how they manage security vulnerabilities
Most (64%) haven't published clear information about encryption and whether they use it
About half (45%) allow weak passwords, including the weak password of ""1"".
Related Classifications: Security Vulnerability
, Snippet Text: *Privacy Not Included found that 73% of the bots it reviewed shared no information on how the company manages security issues, and 64% didn’t have 'clear information about encryption' or even if the company uses it.
Related Classifications: Lack of Transparency
",
GMF,635,False,"Deepfake Image Generation, Social Media Content Generation, Voice Generation","Snippet Text: YouTube videos using a mix of artificial intelligence-generated and manipulated media to create fake content have flooded the platform with salacious disinformation about dozens of Black celebrities, including rapper and record executive Sean “Diddy” Combs, TV host Steve Harvey, actor Denzel Washington and Bishop T.D. Jakes.
Related Classifications: Deepfake Image Generation
, Snippet Text: “We’ve seen these pages that pop up on YouTube or TikTok, and they will have an AI-generated picture of Rihanna crying over A$AP [Rocky] going to jail, and it’s completely fake,” Nwandu said.
Related Classifications: Social Media Content Generation
, Snippet Text: A YouTube search for “TD Jakes” surfaces false content that appears to use generative AI tools for voiceovers in the first five search results. 
Related Classifications: Voice Generation
",,,,,,,,Transformer,,,"Misinformation Generation Hazard, Unsafe Exposure or Access","Snippet Text: YouTube videos using a mix of artificial intelligence-generated and manipulated media to create fake content have flooded the platform with salacious disinformation about dozens of Black celebrities, including rapper and record executive Sean “Diddy” Combs, TV host Steve Harvey, actor Denzel Washington and Bishop T.D. Jakes.
Related Classifications: Misinformation Generation Hazard, Unsafe Exposure or Access
",,,,
GMF,634,False,"Deepfake Video Generation, Voice Generation","Snippet Text: A finance worker at a multinational firm was tricked into paying out $25 million to fraudsters using deepfake technology to pose as the company's chief financial officer in a video conference call, according to Hong Kong police.
Related Classifications: Deepfake Video Generation
, Snippet Text: However, the worker put aside his early doubts after the video call because other people in attendance had looked and sounded just like colleagues he recognized, Chan said.


Related Classifications: Voice Generation
",,,,,,,,Transformer,,"ASR not included, since:
""The police official also said that scammers asked the victim to introduce himself but did not actually interact with the person during the meeting. Additionally, the fake images on the screen mainly gave orders before the call ended abruptly. ""","Misinformation Generation Hazard, Unsafe Exposure or Access","Snippet Text: A finance worker at a multinational firm was tricked into paying out $25 million to fraudsters using deepfake technology to pose as the company's chief financial officer in a video conference call, according to Hong Kong police.
Related Classifications: Misinformation Generation Hazard, Unsafe Exposure or Access
",,,,
GMF,633,False,Image Retouching,,Animal Justice Party MP Georgie Purcell has criticised an Australian news organisation for photoshopping a picture of her outfit and body to appear more curvaceous.,,,,,,,"Transformer, Convolutional Neural Network, Inpainting","Snippet Text: Animal Justice Party MP Georgie Purcell has criticised an Australian news organisation for photoshopping a picture of her outfit and body to appear more curvaceous.
Related Classifications: Transformer, Convolutional Neural Network, Inpainting
",,"Misinformation Generation Hazard, Misuse, Inadequate Verification","Snippet Text: Animal Justice Party MP Georgie Purcell has criticised an Australian news organisation for photoshopping a picture of her outfit and body to appear more curvaceous.
Related Classifications: Misinformation Generation Hazard, Misuse
, Snippet Text: ""During that process, the automation by Photoshop created an image that was not consistent with the original.

""This did not meet the high editorial standards we have and for that we apologise to Ms Purcell unreservedly.""
Related Classifications: Inadequate Verification
",,,,
GMF,7,False,Automatic Copy-Editing,"Snippet Text: Since Wikipedia launched in 2001, its millions of articles have been ranged over by software robots, or simply “bots”, that are built to mend errors, add links to other pages, and perform other basic housekeeping tasks.
Related Classifications: Automatic Copy-Editing
",,,,,,,,"Language Modeling, Named Entity Recognition","Snippet Text: Since Wikipedia launched in 2001, its millions of articles have been ranged over by software robots, or simply “bots”, that are built to mend errors, add links to other pages, and perform other basic housekeeping tasks.
Related Classifications: Named Entity Recognition
",,"Miscoordination, Multiagent Goal Divergence","Snippet Text: The researchers at Oxford and the Alan Turing Institute in London examined the editing histories of pages in 13 different language editions and recorded when bots undid other bots’ changes.
Related Classifications: Miscoordination, Multiagent Goal Divergence
, Snippet Text: The researchers at Oxford and the Alan Turing Institute in London examined the editing histories of pages in 13 different language editions and recorded when bots undid other bots’ changes.
",,"Concept Drift, Distributional Bias, Deployment Misconfiguration, Inadequate Verification","Snippet Text: Yasseri believes the work serves as an early warning to companies developing bots and more powerful artificial intelligence (AI) tools. An AI that works well in the lab might behave unpredictably in the wild.
Related Classifications: Concept Drift
, Snippet Text: Bots designed to work in the same way, or use the same code, sometimes end up disagreeing with each over cultural and language points. And some cultures provoke more arguments and edit wars.

“The findings show that even the same technology leads to different outcomes, depending on the cultural environment,"" Prof Yasseri told The Register.
Related Classifications: Concept Drift, Distributional Bias
, Snippet Text: ""We find that, although Wikipedia bots are intended to support the encyclopedia, they often undo each other's edits and these sterile 'fights' may sometimes continue for years,"" the study reads.
Related Classifications: Deployment Misconfiguration, Inadequate Verification
Snippet Discussion: Perhaps simple configuration, e.g. of maximum number of retries, article blacklisting, human verification on sequences of multiple edits, etc., could have lessened the problem.
",
GMF,658,False,Deepfake Video Generation,"Snippet Text: The Arizona Agenda, a local newsletter covering state politics, made a deepfake of Kari Lake warning readers about the ""terrifying new age"" of artificial intelligence (AI) interference in elections.
Related Classifications: Deepfake Video Generation
",,,,,,,,"Transformer, Convolutional Neural Network, Generative Adversarial Network","Snippet Text: The Arizona Agenda, a local newsletter covering state politics, made a deepfake of Kari Lake warning readers about the ""terrifying new age"" of artificial intelligence (AI) interference in elections.
Related Classifications: Transformer, Convolutional Neural Network, Generative Adversarial Network
",,"Misinformation Generation Hazard, Unsafe Exposure or Access","Snippet Text: The Arizona Agenda, a local newsletter covering state politics, made a deepfake of Kari Lake warning readers about the ""terrifying new age"" of artificial intelligence (AI) interference in elections.
Related Classifications: Misinformation Generation Hazard, Unsafe Exposure or Access
, Snippet Text: There are signs that AI --- and the fear surrounding it --- is already having an impact on the race
Related Classifications: Misinformation Generation Hazard, Unsafe Exposure or Access
",,,,
GMF,648,False,Voice Generation,"Snippet Text: On February 7, 2024, just a day before Pakistan's highly anticipated general elections, from which former Prime Minister Imran Khan was barred because of a graft conviction, a voice recording alleged to be of the imprisoned popular leader circulated on social media.
Related Classifications: Voice Generation
",,,,,,,,"Transformer, Convolutional Neural Network, Recurrent Neural Network, Generative Adversarial Network","Snippet Text: On February 7, 2024, just a day before Pakistan's highly anticipated general elections, from which former Prime Minister Imran Khan was barred because of a graft conviction, a voice recording alleged to be of the imprisoned popular leader circulated on social media.
Related Classifications: Transformer, Convolutional Neural Network, Recurrent Neural Network, Generative Adversarial Network
",,"Misinformation Generation Hazard, Unsafe Exposure or Access","Snippet Text: On February 7, 2024, just a day before Pakistan's highly anticipated general elections, from which former Prime Minister Imran Khan was barred because of a graft conviction, a voice recording alleged to be of the imprisoned popular leader circulated on social media.
Related Classifications: Misinformation Generation Hazard, Unsafe Exposure or Access
",,,,
GMF,198,False,Deepfake Video Generation,"Snippet Text: A deepfake video of Ukrainian president Volodymyr Zelenksy calling on his country’s troops to surrender to Russian forces reportedly made it onto a hacked Ukrainian news site today after going viral on Facebook, 
Related Classifications: Deepfake Video Generation
",,,,,"Transformer, Generative Adversarial Network, Convolutional Neural Network","Snippet Text: A deepfake video of Ukrainian president Volodymyr Zelenksy calling on his country’s troops to surrender to Russian forces reportedly made it onto a hacked Ukrainian news site today after going viral on Facebook, 
Related Classifications: Transformer, Generative Adversarial Network, Convolutional Neural Network
",,,,,"Misinformation Generation Hazard, Unsafe Exposure or Access","Snippet Text: A deepfake video of Ukrainian president Volodymyr Zelenksy calling on his country’s troops to surrender to Russian forces reportedly made it onto a hacked Ukrainian news site today after going viral on Facebook, 
Related Classifications: Misinformation Generation Hazard, Unsafe Exposure or Access
",,,,
GMF,649,False,Voice Generation,"Snippet Text: Many users in the comments speculate that the recording is fake, and it certainly appears to be. Assessing the authenticity of an audio clip is difficult, which makes audio deepfakes especially suitable for online misinformation.
Related Classifications: Voice Generation
Snippet Discussion: 
","Classifying this as a 'potential goal' is not really fitting, as it renders the incident itself an unfitting entry.",,,,,,,"Convolutional Neural Network, Recurrent Neural Network, Generative Adversarial Network, Transformer","Snippet Text: Many users in the comments speculate that the recording is fake, and it certainly appears to be. Assessing the authenticity of an audio clip is difficult, which makes audio deepfakes especially suitable for online misinformation.
Related Classifications: Convolutional Neural Network, Recurrent Neural Network, Generative Adversarial Network, Transformer
",,"Misinformation Generation Hazard, Unsafe Exposure or Access","Snippet Text: Many users in the comments speculate that the recording is fake, and it certainly appears to be. Assessing the authenticity of an audio clip is difficult, which makes audio deepfakes especially suitable for online misinformation.
Related Classifications: Misinformation Generation Hazard, Unsafe Exposure or Access
",,,,
