GMF,91,False,Resource Allocation,"Snippet Text: Stanford Medicine residents who work in close contact with COVID-19 patients were left out of the first wave of staff members for the new Pfizer vaccine.
Related Classifications: Resource Allocation
",,,,,,,,"Classification, Combinatorial Optimization","Snippet Text: An algorithm chose who would be the first 5,000 in line. 
Related Classifications: Classification, Combinatorial Optimization
",,,,,"Incomplete Data Attribute Capture, Problematic Features, Hardcoding, Lack of Transparency","Snippet Text: The residents said they were told they were at a disadvantage because they did not have an assigned “location” to plug into the calculation and because they are young, according to an email sent by a chief resident to his peers. Residents are the lowest-ranking doctors in a hospital. Stanford Medicine has about 1,300 across all disciplines.
Related Classifications: Incomplete Data Attribute Capture, Problematic Features, Hardcoding
, Snippet Text: Only seven made the priority vaccination list, despite the fact that this week, residents were asked to volunteer for ICU coverage in anticipation of a surge in COVID-19 cases.
Related Classifications: Hardcoding
",
GMF,89,False,Content Recommendation,"Snippet Text: wired.com · 2020

Edit

YOUTUBE, FACEBOOK, AND other social media platforms were instrumental in radicalizing the terrorist who killed 51 worshippers in a March 2019 attack on two New Zealand mosques, according to a new report from the country’s government.
Related Classifications: Content Recommendation
",,,,,"Content-based Filtering, Collaborative Filtering","Snippet Text: wired.com · 2020

Edit

YOUTUBE, FACEBOOK, AND other social media platforms were instrumental in radicalizing the terrorist who killed 51 worshippers in a March 2019 attack on two New Zealand mosques, according to a new report from the country’s government.
Related Classifications: Content-based Filtering, Collaborative Filtering
",,,,,"Unsafe Exposure or Access, Misinformation Generation Hazard","Snippet Text: A damning 2018 report by Stanford researcher and PhD candidate Becca Lewis describes the alternative media system on YouTube that fed young viewers far-right propaganda. 
Related Classifications: Unsafe Exposure or Access, Misinformation Generation Hazard
",,,,
GMF,88,False,Content Search,"Snippet Text: The Network Contagion Research Institute, which studies the way hate speech spreads online, located a series of posts on the 4chan message board, dating back to 2017, that purposefully pair images of ovens on wheels with the term “Jewish baby stroller.” There were at least a dozen such images turned up in one search, dating from August and September 2017. 
Related Classifications: Content Search
",,,,,Content-based Filtering,"Snippet Text: The Network Contagion Research Institute, which studies the way hate speech spreads online, located a series of posts on the 4chan message board, dating back to 2017, that purposefully pair images of ovens on wheels with the term “Jewish baby stroller.” There were at least a dozen such images turned up in one search, dating from August and September 2017. 
Related Classifications: Content-based Filtering
",,Vector Search,,,"Unsafe Exposure or Access, Context Misidentification, Faulty or Inadequate Preprocessing, Gaming Vulnerability","Snippet Text: The Network Contagion Research Institute, which studies the way hate speech spreads online, located a series of posts on the 4chan message board, dating back to 2017, that purposefully pair images of ovens on wheels with the term “Jewish baby stroller.” There were at least a dozen such images turned up in one search, dating from August and September 2017. 
Related Classifications: Unsafe Exposure or Access, Context Misidentification
, Snippet Text: “It’s either a raid from 4chan trolls or it’s a meme that circulated on the web,” said Alex Goldenberg, the institute’s lead intelligence analyst. “The Google search algorithm is driving it to the top for some reason, or the item in the meme is tricking the Google algorithm.”
Related Classifications: Context Misidentification
, Snippet Text: If it was a coordinated action by online anti-Semites, called a “raid,” it wouldn’t be the first one. In a 2016 “raid” called Operation Google, extremists tried to undermine a new tool Google had for spotting and filtering out racial and ethnic slurs. 
Related Classifications: Faulty or Inadequate Preprocessing
, Snippet Text: They did this by replacing the slurs in their comments with the names of tech companies. So, for example, they used the word “Google” instead of the n-word, and used the word “Skype” to refer to Jews. They hoped that doing that would force Google to censor its own name, which did not happen.
Related Classifications: Gaming Vulnerability
",,,,
GMF,87,False,Image Verification,"Snippet Text: Women with darker skin are more than twice as likely to be told their photos fail UK passport rules when they submit them online than lighter-skinned men, according to a BBC investigation.
Related Classifications: Image Verification
",,,,,"Image Classification, Face Detection, Visual Object Detection, Image Segmentation","Snippet Text: The passport application website uses an automated check to detect poor quality photos which do not meet Home Office rules. These include having a neutral expression, a closed mouth and looking straight at the camera.
Related Classifications: Image Classification, Face Detection, Visual Object Detection, Image Segmentation
",,,,,"Generalization Failure, Distributional Bias, Limited Dataset, Dataset Imbalance","Snippet Text: Women with darker skin are more than twice as likely to be told their photos fail UK passport rules when they submit them online than lighter-skinned men, according to a BBC investigation.
Related Classifications: Generalization Failure, Distributional Bias, Limited Dataset, Dataset Imbalance
, Snippet Text: ""The impact of automated systems on ethnic minority communities is regularly overlooked, with detrimental consequences.""
Related Classifications: Distributional Bias, Limited Dataset, Dataset Imbalance
, Snippet Text: So a training dataset with less representation of women and people of colour will produce a system that doesn't work well for those groups.
Related Classifications: Distributional Bias, Limited Dataset, Dataset Imbalance
",,,,
GMF,86,False,Automatic Skill Assessment,"Snippet Text: This week it emerged that a problem was discovered with the Leaving Certificate calculated grades system which means thousands of students will have their results upgraded.
Related Classifications: Automatic Skill Assessment
",,,,,Conditional Logic,"Snippet Text: First, the code substituted a student’s worst two subjects for their best two subjects. Then it wrongly added a subject into the equation - the results of the Junior Cycle’s Civic, Social and Political Education. This shouldn’t have been counted.
Related Classifications: Conditional Logic
",,,,,"Software Bug, Lack of Transparency","Snippet Text: We know that the code wasn’t sufficiently tested, which is normally a crucial part of any software release. Department officials say that there simply wasn’t enough time to test everything thoroughly due to the urgency of the situation and the resourcing constraints. They emphasised that this wasn’t a software package already being used elsewhere. It was custom-built for the particulars of our situation.
Related Classifications: Software Bug
, Snippet Text: We don’t. The code - and the implementation of the algorithms - aren’t available to check. In other words, they’re not ‘open source’ or reviewable in the way that, for example, the Irish Covid-19 Tracker smartphone app code is.
Related Classifications: Lack of Transparency
",,,,
GMF,84,False,Fact Checking,"Snippet Text: Something as simple as changing the font of a message or cropping an image can be all it takes to bypass Facebook's defenses against hoaxes and lies.
Related Classifications: Fact Checking
",,,,,Classification,"Snippet Text: Something as simple as changing the font of a message or cropping an image can be all it takes to bypass Facebook's defenses against hoaxes and lies.
Related Classifications: Classification
",,Convolutional Neural Network,"Snippet Text: Something as simple as changing the font of a message or cropping an image can be all it takes to bypass Facebook's defenses against hoaxes and lies.
Related Classifications: Convolutional Neural Network
",,Generalization Failure,"Snippet Text: But Facebook did not apply the same label to versions of the message that were nearly identical, except with different backgrounds or croppings.
Related Classifications: Generalization Failure
",,"Overfitting, Inadequate Data Augmentation, Inadequate Verification","Snippet Text: But Facebook did not apply the same label to versions of the message that were nearly identical, except with different backgrounds or croppings.
Related Classifications: Overfitting, Inadequate Data Augmentation
, Snippet Text: A meme claiming mail-in ballots need two stamps was labeled ""partly false."" But Facebook did not label other versions of the same message — versions in which the user had changed the font or background color, or written out the text of the meme instead of posting it as an image. 
Related Classifications: Overfitting, Inadequate Data Augmentation, Inadequate Verification
",
GMF,83,False,Spam Filtering,"Snippet Text: An experiment reveals that Microsoft Outlook marks messages as spam on the basis of a single word, such as “Nigeria”. Spam filters are largely unaudited and could discriminate unfairly.
Related Classifications: Spam Filtering
",,,,,Keyword Filtering,"Snippet Text: An internship application from a Nigerian student. The same email with the word “Nigeria” removed was delivered to the inbox.
Related Classifications: Keyword Filtering
",,"Language Modeling, Classification","Snippet Text: An internship application from a Nigerian student. The same email with the word “Nigeria” removed was delivered to the inbox.
Related Classifications: 
, Snippet Text: Microsoft declined to comment. It is unlikely that an Outlook engineer made an explicit rule to mark any message that contains “Nigeria” as spam. Instead, a machine learning algorithm probably identified “Nigeria” as a strong discriminator between spam and non-spam messages. Microsoft does not make the training data set of its spam filter available to researchers.
Related Classifications: Classification
",,"Lack of Transparency, Hardcoding, Context Misidentification","Snippet Text: Microsoft declined to comment. It is unlikely that an Outlook engineer made an explicit rule to mark any message that contains “Nigeria” as spam. Instead, a machine learning algorithm probably identified “Nigeria” as a strong discriminator between spam and non-spam messages. Microsoft does not make the training data set of its spam filter available to researchers.
Related Classifications: Lack of Transparency
, Snippet Text: While SpamAssassin’s rules change daily, its default configuration files single out words like “Ivory Coast”, “Nigeria” or “Nigerian government” as spammy. The phrase “Oprah!”, an African-American entertainer, is listed as potentially spammy, though the rule is currently inactive.
Related Classifications: Hardcoding, Context Misidentification
",,,,
GMF,82,False,Fact Checking,"Snippet Text: On Wednesday, October 21, 2020, several content containing images related to the unfortunate incident that occurred at the Lekki toll gate in Lagos, Nigeria on Tuesday were flagged as misinformation on Facebook and Instagram.
Related Classifications: Fact Checking
",,,,,,,,Classification,"Snippet Text: Facebook uses a hybrid system of human moderators and Artificial Intelligence (AI) to check misinformation. It partners with certified independent third-party fact-checking organisations — over 27 partners across 88 countries — to identify, review, and confirm potentially inaccurate content to curb viral misinformation. These content are usually first flagged as inaccurate by feedback from users, Facebook’s signal technology, or fact-checkers.
Related Classifications: Classification
",,Inadequate Verification,"Snippet Text: On Instagram and Facebook, images of Lekki Concession Centre (LCC) staff that allegedly came to uninstall the CCTV camera from the scene a few hours to the sad incident, protesters staying together while holding the Nigeria flag, a bloodied Nigeria flag, reported survivors at the hospital, and corpses from the scene are all flagged false information; invariably suggesting that the October 20 military attack was fake.
Related Classifications: Inadequate Verification
",,Data or Labelling Noise,"Snippet Text: Of course, these fact-checking firms are not without their accusation of bias. Besides, Facebook has yet to completely figure out what ‘inaccurate information’ means. 
Related Classifications: Data or Labelling Noise
Snippet Discussion: Fact-checking firm bias may introduce labelling noise.
",
GMF,81,False,Image Tagging,"Snippet Text: Google and startups like Qure.ai, Aidoc, and DarwinAI are developing AI and machine learning systems that classify chest X-rays to help identify conditions like fractures and collapsed lungs. 
Related Classifications: Image Tagging
",,,,,Image Classification,"Snippet Text: Google and startups like Qure.ai, Aidoc, and DarwinAI are developing AI and machine learning systems that classify chest X-rays to help identify conditions like fractures and collapsed lungs. 
Related Classifications: Image Classification
, Snippet Text: After feeding the classifiers the datasets to demonstrate they reached near-state-of-the-art classification performance, which ruled out the possibility that any disparities simply reflected poor overall performance, the researchers calculated and identified disparities across the labels, datasets, and attributes. They found that all four datasets contained “meaningful” patterns of bias and imbalance, with female patients suffering from the highest disparity despite the fact the proportion of women was only slightly less than men.
Related Classifications: Image Classification
",,Convolutional Neural Network,"Snippet Text: Google and startups like Qure.ai, Aidoc, and DarwinAI are developing AI and machine learning systems that classify chest X-rays to help identify conditions like fractures and collapsed lungs. 
Related Classifications: Convolutional Neural Network
",,"Distributional Bias, Limited Dataset","Snippet Text: A team of U.K. scientists found that almost all eye disease datasets come from patients in North America, Europe, and China, meaning eye disease-diagnosing algorithms are less certain to work well for racial groups from underrepresented countries.
Related Classifications: Distributional Bias, Limited Dataset
, Snippet Text: And a growing body of work suggests that skin cancer-detecting algorithms tend to be less precise when used on Black patients, in part because AI models are trained mostly on images of light-skinned patients.
Related Classifications: Distributional Bias, Limited Dataset
, Snippet Text: After feeding the classifiers the datasets to demonstrate they reached near-state-of-the-art classification performance, which ruled out the possibility that any disparities simply reflected poor overall performance, the researchers calculated and identified disparities across the labels, datasets, and attributes. They found that all four datasets contained “meaningful” patterns of bias and imbalance, with female patients suffering from the highest disparity despite the fact the proportion of women was only slightly less than men.
Related Classifications: Distributional Bias, Limited Dataset
",,,,
GMF,80,False,Camera Tracking,"Snippet Text: This happened over the weekend in a soccer game in Scotland, when an AI-controlled camera got confused, and thought a lineman’s bald head was the ball.
Related Classifications: Camera Tracking
",,,,,Visual Object Detection,"Snippet Text: This happened over the weekend in a soccer game in Scotland, when an AI-controlled camera got confused, and thought a lineman’s bald head was the ball.
Related Classifications: Visual Object Detection
",,,,,Generalization Failure,"Snippet Text: This happened over the weekend in a soccer game in Scotland, when an AI-controlled camera got confused, and thought a lineman’s bald head was the ball.
Related Classifications: Generalization Failure
",,,,
GMF,79,False,Medical Diagnosis Support,"Snippet Text: The test — which measures what’s known as estimated glomerular filtration rate, or eGFR — has historically considered four factors: age, gender, race, and levels of creatinine — the waste that kidneys filter out of blood.
Related Classifications: Medical Diagnosis Support
",,,,,,,,Regression,"Snippet Text: The test — which measures what’s known as estimated glomerular filtration rate, or eGFR — has historically considered four factors: age, gender, race, and levels of creatinine — the waste that kidneys filter out of blood.
Related Classifications: Regression
",,"Algorithmic Bias, Problematic Features","Snippet Text: But the race of a patient can only be bucketed into two groups: Black, or not Black. That’s based on a flawed assumption that dates back to the formula’s creation, when medical experts presumed that Black people have higher muscle mass on average, leading to higher kidney function
Related Classifications: Algorithmic Bias, Problematic Features
",,,,
GMF,78,False,Application Evaluation,"Snippet Text: EIGHTEEN-YEAR-OLD ANAHITA NAGPAL fears her plans to start training this fall to be a doctor have been derailed by a statistical model.
Related Classifications: Application Evaluation
",,,,,,,,Regression,"Snippet Text: Nagpal, who lives in Göttingen, Germany, had been offered a premed place and scholarship at NYU. Her acceptance was dependent on her results in the International Baccalaureate diploma, a two-year high school program recognized by colleges and taken by more than 170,000 students this year, most in the US. But she scored more poorly than expected.
Related Classifications: Regression
",,"Lack of Transparency, Faulty Interface or Instructions","Snippet Text: One math teacher at a school in the Middle East says IB should disclose the full workings of its model for outside scrutiny. He and a colleague with a math PhD have been puzzling over its design since several students lost scholarships to top universities, after receiving results much lower than expected by their teachers.
Related Classifications: Lack of Transparency
, Snippet Text:  IB did not disclose details of the methodology but said grades would be calculated based on a student’s assignment scores, predicted grades, and historical IB results from their school.
Related Classifications: Lack of Transparency
, Snippet Text: Students at the school submitted their assignments before IB said those assignments would help steer the grading model. Some IB students at other schools had not yet submitted those assignments, allowing them to put in extra effort, aided by knowing they didn’t have to prepare for exams. 
Related Classifications: Faulty Interface or Instructions
",,"Incomplete Data Attribute Capture, Software Bug, Generalization Failure","Snippet Text: One visual arts teacher at a US school says what she and coworkers have seen suggests it wasn’t well tailored. “When I saw the marks, I was floored,” she says. “I am always conservative in my predicted grades, but every single student except one were downgraded.”
Related Classifications: Incomplete Data Attribute Capture, Software Bug, Generalization Failure
, Snippet Text: Constance Lavergne, whose son in the UK received lower-than-expected IB grades and missed out on his preferred college, is one of many parents struggling to understand what happened. She says her experience working closely with data analysts in the tech industry makes her suspicious of IB’s methodology. It would naturally generate noisier results for smaller classes, like her son’s, because they offer fewer past data points, she suggests. “There’s something wrong with the algorithm,” Lavergne says.
Related Classifications: Software Bug
",
GMF,101,False,Regulatory Monitoring,"Snippet Text: From 2013 on (though these techniques could have been used earlier), authorities used algorithms to create risk profiles of residents who were supposedly more likely to commit fraud and then used automated systems with little oversight to scan through benefits applicants and flag likely fraudsters who were then forced to pay money they didn’t owe in reality.
Related Classifications: Regulatory Monitoring
",,,,,Classification,"Snippet Text: From 2013 on (though these techniques could have been used earlier), authorities used algorithms to create risk profiles of residents who were supposedly more likely to commit fraud and then used automated systems with little oversight to scan through benefits applicants and flag likely fraudsters who were then forced to pay money they didn’t owe in reality.
Related Classifications: Classification
, Snippet Text: 
",,Tree-based Learning,"Snippet Text: An investigation from the Dutch Data Protection Authority found that these algorithms were inherently discriminatory because they took variables such as whether someone had a second nationality into account.
Related Classifications: Tree-based Learning
",,"Algorithmic Bias, Problematic Features, Harmful Application, Lack of Safety Protocols","Snippet Text: An investigation from the Dutch Data Protection Authority found that these algorithms were inherently discriminatory because they took variables such as whether someone had a second nationality into account.
Related Classifications: Algorithmic Bias, Problematic Features
, Snippet Text: Authorities penalized families over a mere suspicion of fraud based on the system’s risk indicators. Tens of thousands of families — often with lower incomes or belonging to ethnic minorities — were pushed into poverty because of exorbitant debts to the tax agency. 
Related Classifications: Harmful Application
, Snippet Text: “There was a total lack of checks and balances within every organization of making sure people realize what was going on,” said Pieter Omtzigt, an independent member of the Dutch parliament who played a pivotal role in uncovering the scandal and grilling the tax authorities. 
Related Classifications: Lack of Safety Protocols
",,Distributional Bias,"Snippet Text: An investigation from the Dutch Data Protection Authority found that these algorithms were inherently discriminatory because they took variables such as whether someone had a second nationality into account.
Related Classifications: Distributional Bias
",
GMF,102,False,AI Voice Assistant,,,,,,Automatic Speech Recognition,"Snippet Text: Speech recognition systems have more trouble understanding black users’ voices than those of white users, according to a new Stanford study.
Related Classifications: Automatic Speech Recognition
",,"Convolutional Neural Network, Recurrent Neural Network, Transformer","Snippet Text: Here, we examine the ability of five state-of-the-art ASR systems—developed by Amazon, Apple, Google, IBM, and Microsoft—to transcribe structured interviews conducted with 42 white speakers and 73 black speakers. 
Related Classifications: Convolutional Neural Network, Recurrent Neural Network, Transformer
",,Algorithmic Bias,"Snippet Text: Speech recognition systems have more trouble understanding black users’ voices than those of white users, according to a new Stanford study.
Related Classifications: Algorithmic Bias
",,Distributional Bias,"Snippet Text: The researchers used voice recognition tools from Apple, Amazon, Google, IBM, and Microsoft to transcribe interviews with 42 white people and 73 black people, all of which took place in the US. The tools misidentified words about 19 percent of the time during the interviews with white people and 35 percent of the time during the interviews with black people. The system found 2 percent of audio snippets from white people to be unreadable, compared to 20 percent of those from black people. The errors were particularly large for black men, with an error rate of 41 percent compared to 30 percent for black women.
Related Classifications: Distributional Bias
, Snippet Text: Here, we examine the ability of five state-of-the-art ASR systems—developed by Amazon, Apple, Google, IBM, and Microsoft—to transcribe structured interviews conducted with 42 white speakers and 73 black speakers. 
Related Classifications: Distributional Bias
Snippet Discussion: Study is from 2020, distributional methods most likely used.
",
