Namespace,Incident ID,Published,Known AI Goal,Known AI Goal Snippets,Known AI Goal Classification Discussion,Potential AI Goal,Potential AI Goal Snippets,Potential AI Goal Classification Discussion,Known AI Technology,Known AI Technology Snippets,Known AI Technology Classification Discussion,Potential AI Technology,Potential AI Technology Snippets,Potential AI Technology Classification Discussion,Known AI Technical Failure,Known AI Technical Failure Snippets,Known AI Technical Failure Classification Discussion,Potential AI Technical Failure,Potential AI Technical Failure Snippets,Potential AI Technical Failure Classification Discussion
GMF,1,True,"Content Recommendation, Content Search, Hate Speech Detection, NSFW Content Detection","Snippet Text: An off-brand Paw Patrol video called ""Babies Pretend to Die Suicide"" features several disturbing scenarios.
The YouTube Kids app filters out most - but not all - of the disturbing videos.

Before any video appears in the YouTube Kids app, it's filtered by algorithms that are supposed to identify appropriate children's content
YouTube also has a team of human moderators that review any videos flagged in the main YouTube app by volunteer Contributors (users who flag inappropriate content) or by systems that identify recognizable children's characters in the questionable video.
Many of those views came from YouTube's ""up next"" and ""recommended"" video section that appears while watching any video. YouTube's algorithms attempt to find videos that you may want to watch based on the video you chose to watch first
If you don't pick another video to watch after the current video ends, the ""up next"" video will automatically play.

Related Classifications: Content Recommendation, Content Search
",,,,,"Content-based Filtering, Collaborative Filtering","Snippet Text: If you searched for ""moon landing"" on YouTube Kids, three videos appeared that claim that the moon landing was hoaxed. All three videos have since been hidden by YouTube after we informed it of the issue.
Related Classifications: Content-based Filtering
",,"Classification, Ensemble Aggregation, Distributional Learning","Snippet Text: 
Part of YouTube’s plan is to increase human moderation and tweak its algorithm, “training machine-learning technology across other challenging content areas, including child safety and hate speech.” YouTube will also cut down on channels that receive monetization and advertisements attached to these videos. Since YouTube Kids also includes ads — many of which, Golin says, aren’t child appropriate — this will affect channels and videos on the platform.
Related Classifications: Ensemble Aggregation
","Classification: Appropriateness could arise by appropriateness classifiers

Ensemble Aggregation: In cases where  ""child-appropriateness"" measure arises from multiple marginal detectors of-related subclasses (e.g. violent, adult, political themes)","Tuning Issues, Lack of Adversarial Robustness, Adversarial Data","Snippet Text: 
Part of YouTube’s plan is to increase human moderation and tweak its algorithm, “training machine-learning technology across other challenging content areas, including child safety and hate speech.” YouTube will also cut down on channels that receive monetization and advertisements attached to these videos. Since YouTube Kids also includes ads — many of which, Golin says, aren’t child appropriate — this will affect channels and videos on the platform.
Related Classifications: Tuning Issues
, Snippet Text: ""Recommendations are designed to optimize watch time, there is no reason that it shows content that is actually good for kids. 
Related Classifications: Tuning Issues
, Snippet Text: On YouTube today, children are being exploited for money. YouTubers with channels specifically marketed toward children are cranking out videos to provide kids with loads of content to consume, as each video around 16 minutes long. (Which is the sweet spot for maximum ad revenue.) Frankly, YouTubers are practically begging their viewers to “smash” that like button and comment on their videos.
I spent a weekend babysitting my brother’s children and they spent most of that time watching channels like Chad Wild Clay. He would ask a question like, “Who is going to win this game?” ask kids to comment their predictions in the comments and then proceed to play the game, giving the kids the answer in the same video. He’d do that same thing several times throughout the video.

What’s the point of the interactive bits if they can just skip ahead and get their answers without commenting at all? It’s simple: the more engagement the video gets, the more likely it is to be picked up by YouTube’s recommendation algorithm, thus bringing in more traffic and more money.
Related Classifications: Tuning Issues
Snippet Discussion: Recommendation training / video ranking is utilizing likes and engagement too much.
, Snippet Text: Conspiracy videos also appear when children search for popular conspiracy theories. Searches for ""chemtrails,"" ""flat earth,"" and ""nibiru"" are all allowed in the app. However, it's (hopefully) unlikely that children are regularly watching these videos unless they appear as suggestions on more popular content in the app.

The conspiracy videos didn't just appear in searches or suggested videos, either. After watching several conspiracy videos, the top recommended video on the home page of YouTube Kids was a conspiracy theory about aliens on the moon:
Related Classifications: Tuning Issues
, Snippet Text: The first line of defense for YouTube Kids are algorithmic filters. After that, there is a team of humans that review videos which have been flagged. If a video with recognizable children’s characters gets flagged in YouTube’s main app, which is much larger than the Kids app, it will be sent to the policy review team. YouTube says it has thousands of people working around the clock in different time zones to review flagged content. If the review finds the video is in violation of the new policy, it will be age restrictied, automatically blocking it from showing up in the Kids app. YouTube says it typically takes at least a few days for content to make its way from YouTube proper to YouTube Kids, and the hope is that within that window, users will flag anything potentially disturbing to children. YouTube also has a team of volunteer moderators, which it calls Contributors, looking for inappropriate content. YouTube says it will start training its review team on the new policy and it should be live within a few weeks. 
It normally takes five days for supposedly child-friendly content like cartoons to get from YouTube to YouTube Kids. Within that window it is hoped users and a specially-trained team will flag disturbing content.



Related Classifications: Lack of Adversarial Robustness, Adversarial Data
","Tuning Issues: Default classification, in cases where the poor consideration of child -appropriateness context information does not fall under current subclasses of this classification.","Concept Drift, Generalization Failure, Misconfigured Aggregation, Distributional Bias, Misaligned Objective","Snippet Text: “From a child standpoint, the problem is not fixable,” Golin said. “The YouTube model has created something, which is so vast, but there are 400 hours of content are uploaded every minute. It’s simply too big. 
Related Classifications: Concept Drift, Generalization Failure
, Snippet Text: ""There are vast, vast numbers of these videos,"" Bridle said. ""Channel after channel after channel of similar content, churned out at the rate of hundreds of new videos every week. Industrialized nightmare production.""
Related Classifications: Generalization Failure
, Snippet Text: 
Part of YouTube’s plan is to increase human moderation and tweak its algorithm, “training machine-learning technology across other challenging content areas, including child safety and hate speech.” YouTube will also cut down on channels that receive monetization and advertisements attached to these videos. Since YouTube Kids also includes ads — many of which, Golin says, aren’t child appropriate — this will affect channels and videos on the platform.
Related Classifications: Misconfigured Aggregation
, Snippet Text: ""Recommendations are designed to optimize watch time, there is no reason that it shows content that is actually good for kids. 
Related Classifications: Misconfigured Aggregation, Misaligned Objective
, Snippet Text: On YouTube today, children are being exploited for money. YouTubers with channels specifically marketed toward children are cranking out videos to provide kids with loads of content to consume, as each video around 16 minutes long. (Which is the sweet spot for maximum ad revenue.) Frankly, YouTubers are practically begging their viewers to “smash” that like button and comment on their videos.
I spent a weekend babysitting my brother’s children and they spent most of that time watching channels like Chad Wild Clay. He would ask a question like, “Who is going to win this game?” ask kids to comment their predictions in the comments and then proceed to play the game, giving the kids the answer in the same video. He’d do that same thing several times throughout the video.

What’s the point of the interactive bits if they can just skip ahead and get their answers without commenting at all? It’s simple: the more engagement the video gets, the more likely it is to be picked up by YouTube’s recommendation algorithm, thus bringing in more traffic and more money.
Related Classifications: Misconfigured Aggregation, Misaligned Objective
Snippet Discussion: Recommendation training / video ranking is utilizing likes and engagement too much.
","Concept Drift: Concept drift in cases where appropriateness evolves and changes with the passage of time and is culturally determined -- e.g. akin to old messed up disney cartoons.

Generalization Failure: Based on huge dataset size.

Misconfigured Aggregation: In cases where  ""child-appropriateness"" measure arises from multiple marginal detectors of-related subclasses (e.g. violent, adult, political themes)

Misaligned Objective: Recommendation training is using child-appropriateness in its objective in a diminished capacity (as a component with a small contribution), or not at all (completely relying in post-hoc reviewing and filtering by other systems and humans)."
GMF,10,True,"Market Forecasting, Scheduling",,,,,,,,,"Regression, Diverse Data","Snippet Text: “You’re waiting on your job to control your life,” she said, with the scheduling software used by her employer dictating everything from “how much sleep Gavin will get to what groceries I’ll be able to buy this month.”
Related Classifications: Regression
, Snippet Text: In a follow-up piece, the author, Jodi Kantor, points directly to Kronos' scheduling software as the root of the problem.
Related Classifications: Diverse Data
","Regression: Potentially the number of required staff and/or some numeric measure of traffic is estimated for each branch?

Diverse Data: Diverse types of input data could involve high-level attributes / categories / conceptual information on employees.",Underspecification,"Snippet Text: “You’re waiting on your job to control your life,” she said, with the scheduling software used by her employer dictating everything from “how much sleep Gavin will get to what groceries I’ll be able to buy this month.”
Related Classifications: Underspecification
, Snippet Text: Along with virtually every major retail and restaurant chain, Starbucks relies on software that choreographs workers in precise, intricate ballets, using sales patterns and other data to determine which of its 130,000 baristas are needed in its thousands of locations and exactly when.
Related Classifications: Underspecification
, Snippet Text: Among other changes, the company said it would end the practice of ""clopening,"" when an employee responsible for closing a store late at night is also assigned to open it early in the morning.
Related Classifications: Underspecification
, Snippet Text: In a follow-up piece, the author, Jodi Kantor, points directly to Kronos' scheduling software as the root of the problem.
Related Classifications: Underspecification
",Underspecification: System is not designed to operate harmoniously with employees.,"Tuning Issues, Misconfigured Aggregation","Snippet Text: In addition, Kronos is improving a feature meant to help give employees more control over their schedules: Though the software already incorporates employee availability and preferences into its scheduling calculations, improvements to a shift-swapping feature on its employee-facing web and mobile apps will theoretically allow employees to work around conflicts among themselves.
Related Classifications: Tuning Issues, Misconfigured Aggregation
","Tuning Issues: Weight of employee preferences is udnervalued in the prediction.

Misconfigured Aggregation: Employee preference decision component is aggregated with very small contribution weight."
GMF,13,True,Hate Speech Detection,"Snippet Text: However, computer scientists and others on the internet have found the system unable to identify a wide swath of hateful comments, while categorizing innocuous word combinations like “hate is bad” and “garbage truck” as overwhelmingly toxic.
Related Classifications: Hate Speech Detection
",,,,,Character NGrams,"Snippet Text: They then captured 1-5 character snippets, called character-level ngrams, of the attacking comments and trained a machine-learning algorithm that those ngrams were correlated with toxic activity.
Related Classifications: Character NGrams
",,Distributional Learning,"Snippet Text: The Google AI tool used to flag “offensive comments” has a seemingly built-in bias against conservative and libertarian viewpoints.


Related Classifications: Distributional Learning
, Snippet Text: But when testing out its algorithm, Perspective generally scores conservative and libertarian comments as more “toxic” than establishment talking points.


Related Classifications: Distributional Learning
, Snippet Text: They believe they are going to use it to fight “toxicity” online. And by “toxicity” they mean “saying anything with negative sentiment”. And by “negative sentiment” they mean “whatever word2vec thinks is bad”. 
Related Classifications: Distributional Learning
, Snippet Text: Annotators read through each transcript and identified segments that appeared to be especially uncivil or civil, rating them on a ten-point scale for measures like “polite/rude,” “friendly/hostile,” “cooperative/quarrelsome,” and “calm/agitated.”
Related Classifications: Distributional Learning
Snippet Discussion: Note that this relates to civility detection.
, Snippet Text: Perspective tends to label certain identities — including “gay,” “African-American,” “Muslim” and “Islam,” “Jew,” “women,” and “feminism” and “feminist” — as toxic. Moreover, the API erroneously flags words relating to violence and death (e.g., “die,” “kill,” “shooting,” “prostitution,” “pornography,” “sexual”) even in the absence of incivility, as well as words that in one context could be toxic but in another could refer to a name (e.g., “Dick”).
Related Classifications: Distributional Learning
Snippet Discussion: Note that this relates to civility detection.
",,"Context Misidentification, Generalization Failure, Lack of Adversarial Robustness","Snippet Text: “This is essentially finding ‘good words’ and ‘bad words,’ but it is clear that it cannot deal with any nuanced (or even just compositional) word usage.”
Related Classifications: Context Misidentification
, Snippet Text: For example, “racism is bad” triggers the old system into giving an overwhelmingly negative score because the words “racism” and “bad” are seen as negative, Goldberg says.
Related Classifications: Context Misidentification
, Snippet Text: The tool seems to rank profanity as highly toxic, while deeply harmful statements are often deemed safe


Related Classifications: Context Misidentification
Snippet Discussion: AI operates naively on modelled word senses.
, Snippet Text: “Character-level models are much better able to understand misspellings and different fragments of words, but overall it’s going to do much worse,” Dixon told Quartz.
Related Classifications: Generalization Failure
, Snippet Text: But in real-world applications, these systems are susceptible to intelligent subversion or attacks,"" said senior author Radha Poovendran, chair of the UW electrical engineering department and director of the Network Security Lab.
Related Classifications: Generalization Failure, Lack of Adversarial Robustness
, Snippet Text: Designing a system with a benign operating environment in mind and deploying it in adversarial environments can have devastating consequences.""
Related Classifications: Generalization Failure
, Snippet Text: For example, simply changing ""idiot"" to ""idiiot"" reduced the toxicity rate of an otherwise identical comment from 84% to 20%.
Related Classifications: Lack of Adversarial Robustness
, Snippet Text: They showed one can subtly modify a phrase that receives a high toxicity score so that it contains the same abusive language but receives a low toxicity score.
Related Classifications: Lack of Adversarial Robustness
, Snippet Text: They showed that the system is vulnerable to both missing incendiary language and falsely blocking non-abusive phrases.
Related Classifications: Lack of Adversarial Robustness
",,"Limited Dataset, Misaligned Objective, Underfitting, Distributional Bias, Data or Labelling Noise","Snippet Text: It’s very limited to the types of abuse and toxicity in that initial training data set. 
Related Classifications: Limited Dataset
, Snippet Text: First, the system shown to Greenberg was a research model specifically trained to detect personal attacks, meaning it would be much more sensitive to words like “you” or “you’re.”
Related Classifications: Misaligned Objective
, Snippet Text: The tool seems to rank profanity as highly toxic, while deeply harmful statements are often deemed safe


Related Classifications: Misaligned Objective, Underfitting, Data or Labelling Noise
Snippet Discussion: AI operates naively on modelled word senses.
, Snippet Text: “Character-level models are much better able to understand misspellings and different fragments of words, but overall it’s going to do much worse,” Dixon told Quartz.
Related Classifications: Underfitting
, Snippet Text: That’s because, while that technique can be efficiently pointed at a very specific problem, like figuring out that smiley faces correlate with someone being nice, the deep neural network being trained through the API now has a much greater capacity to understand the nuances of the entire language.
Related Classifications: Underfitting
, Snippet Text: The Google AI tool used to flag “offensive comments” has a seemingly built-in bias against conservative and libertarian viewpoints.


Related Classifications: Distributional Bias
, Snippet Text: But when testing out its algorithm, Perspective generally scores conservative and libertarian comments as more “toxic” than establishment talking points.


Related Classifications: Distributional Bias
, Snippet Text: They believe they are going to use it to fight “toxicity” online. And by “toxicity” they mean “saying anything with negative sentiment”. And by “negative sentiment” they mean “whatever word2vec thinks is bad”. 
Related Classifications: Distributional Bias
, Snippet Text: Annotators read through each transcript and identified segments that appeared to be especially uncivil or civil, rating them on a ten-point scale for measures like “polite/rude,” “friendly/hostile,” “cooperative/quarrelsome,” and “calm/agitated.”
Related Classifications: Distributional Bias
Snippet Discussion: Note that this relates to civility detection.
, Snippet Text: Perspective tends to label certain identities — including “gay,” “African-American,” “Muslim” and “Islam,” “Jew,” “women,” and “feminism” and “feminist” — as toxic. Moreover, the API erroneously flags words relating to violence and death (e.g., “die,” “kill,” “shooting,” “prostitution,” “pornography,” “sexual”) even in the absence of incivility, as well as words that in one context could be toxic but in another could refer to a name (e.g., “Dick”).
Related Classifications: Distributional Bias
Snippet Discussion: Note that this relates to civility detection.
, Snippet Text: The Alphabet subsidiary worked with partners like Wikipedia and The New York Times to gather hundreds of thousands of comments, and then crowdsourced 10 answers for each comment on whether they were toxic or not. 
Related Classifications: Data or Labelling Noise
",Data or Labelling Noise: Potentially profanity was annotated as hate speech.
GMF,16,True,Image Tagging,"Snippet Text: Google has been forced to apologise after its image recognition software mislabelled photographs of black people as gorillas.


Related Classifications: Image Tagging
",,,,,"Face Detection, Convolutional Neural Network, Keyword Filtering","Snippet Text: He said however the error may occur in photographs where their image recognition software failed to detect a face at all.


Related Classifications: Face Detection
, Snippet Text: Engineers at Google's research labs also recently ran various pictures through its ""neural network"", asking the software to identify patterns in the images and then alter that image to exaggerate the patterns.
Related Classifications: Convolutional Neural Network
, Snippet Text: A Google spokesperson confirmed that “gorilla” was censored from searches and image tags after the 2015 incident, and that “chimp,” “chimpanzee,” and “monkey” are also blocked today.
Related Classifications: Keyword Filtering
, Snippet Text: Searches for “black man” and “black woman” turned up photos of people of the chosen gender in black and white, rather than of a given race.
Related Classifications: Keyword Filtering
",,,,,Underfitting,"Snippet Text: Google has been forced to apologise after its image recognition software mislabelled photographs of black people as gorillas.


Related Classifications: Underfitting
",,"Dataset Imbalance, Context Misidentification","Snippet Text: While the app’s algorithm was able to correctly identify pictures of a “graduation,” “skyscrapers,” and “airplanes,” it labeled photos of Alcine and a female friend as gorillas.
Related Classifications: Dataset Imbalance
, Snippet Text: A Google spokesperson confirmed that “gorilla” was censored from searches and image tags after the 2015 incident, and that “chimp,” “chimpanzee,” and “monkey” are also blocked today.
Related Classifications: Context Misidentification
",
GMF,21,True,Question Answering,"Snippet Text: The Winograd Schema Challenge asks computers to make sense of sentences that are ambiguous but usually simple for humans to parse.
Related Classifications: Question Answering
",,,,,"Language Modeling, Distributional Learning","Snippet Text: Hand-coding knowledge is impossibly time-consuming, and it isn’t simple for computers to learn about the real world by performing statistical analysis of text.
Related Classifications: Language Modeling, Distributional Learning
","Language Modeling: Presumably the model is not large enough to capture correctly enough context information during training, and /or grammatical structures required to correctly disambiguate non-straightforward cases.

Distributional Learning: This classification is a more focused description of the symptom",Transformer,"Snippet Text: Liu’s group, which included researchers from York University in Toronto and the National Research Council of Canada, used deep learning to train a computer to recognize the relationship between different events, such as “playing basketball” and “winning” or “getting injured,” from thousands of texts.
Related Classifications: Transformer
",,,,,"Generalization Failure, Dataset Imbalance, Underfitting, Context Misidentification","Snippet Text: The best two entrants were correct 48 percent of the time, compared to 45 percent if the answers are chosen at random. 
Related Classifications: Generalization Failure
, Snippet Text: In the sentence “The city councilmen refused the demonstrators a permit because they feared violence,” it is logically unclear who the word “they” refers to, although humans understand because of the broader context.
Related Classifications: Dataset Imbalance, Underfitting
, Snippet Text: The Winograd Schema Challenge asks computers to make sense of sentences that are ambiguous but usually simple for humans to parse.
Related Classifications: Context Misidentification
","Generalization Failure: Generic diagnosis

Underfitting: Presumably the model is not large enough to capture correctly enough context information during training, and /or grammatical structures required to correctly disambiguate non-straightforward cases.

Context Misidentification: This classification is a more focused description of the symptom"
