GMF,188,False,Medical Diagnosis Support,"Snippet Text: On 4/11/2018, in the television program “El Diario de Mariana”, the Governor of Salta, Juan Manuel Urtubey, described an artificial intelligence system supposedly capable of predicting teenage pregnancies
Related Classifications: Medical Diagnosis Support
",,,,,Classification,"Snippet Text: The study details the following procedure:
Construct a set of statistical rules to try to determine if a teenager will have a pregnancy in the future.
Those rules are built based on known data (the “training data”). So, the statistical rules are made in the image and likeness of the training data.
Once the statistical rules are built, they should be tested using new, unknown data (the “evaluation data”), thus calculating their “accuracy” (how many times it is correct in the predictions).

",,,,,"Data or Labelling Noise, Incomplete Data Attribute Capture","Snippet Text: The problem here is that the evaluation data (in step 3) includes almost identical replicas of many training data.
Related Classifications: Data or Labelling Noise
, Snippet Text: Data on adolescent pregnancies have a tendency to be biased or incomplete, due to the fact that they are a sensitive and confidential subject, difficult to access. For example, in many families, teenage pregnancies tend to be hidden, and even clandestinely terminated. Therefore, the data used has the risk of including more adolescent pregnancies from certain sectors of society than from others.

Related Classifications: Data or Labelling Noise
, Snippet Text: 
, Snippet Text: The data used was extracted from a survey of adolescents living in the province of Salta containing personal information (age, ethnicity, country of origin, etc), about their environment (number of people with whom they live, if they have hot water in the bathroom, etc) and whether she had completed or was undergoing, at the time of the survey, a pregnancy.
These data are not adequate to answer the question posed: if an adolescent will have a pregnancy in the future (for example, in 5 or 6 six years). For that, it would be necessary to have data collected 5 or 6 years before the pregnancy occurs.

Related Classifications: Incomplete Data Attribute Capture
",,,,
GMF,189,False,Regulatory Monitoring,"Snippet Text: Disabled people are being subjected to stressful checks and months of frustrating bureaucracy after being identified as potential benefit fraudsters by an algorithm the government is refusing to disclose, according to a new legal challenge.

Related Classifications: Regulatory Monitoring
",,,,,,,,"Classification, Record Linkage","Snippet Text: The Department for Work and Pensions (DWP) has previously conceded that it uses “cutting-edge artificial intelligence” to track possible fraud but has so far rebuffed attempts to explain how the algorithm behind the system was compiled. Campaigners say that once flagged, those being examined can face an invasive and humiliating investigation lasting up to a year.
Related Classifications: Classification
, Snippet Text: While an FOI request filed by Privacy International confirmed that the DWP was using data matching – what is essentially a simple algorithmic process – to flag benefit claimants for investigation, the DWP has been cagey about details.

Related Classifications: Record Linkage
",,"Harmful Application, Lack of Transparency","Snippet Text: The Department for Work and Pensions (DWP), which is responsible for the UK’s social security system and benefits support for some of the country’s most vulnerable, deploys excessive surveillance methods, according to a new report by Privacy International. Cracking down on benefit fraud has been a target of successive UK governments, despite it making up a tiny proportion of benefits administered.
Related Classifications: Harmful Application
, Snippet Text: The Department for Work and Pensions (DWP) has previously conceded that it uses “cutting-edge artificial intelligence” to track possible fraud but has so far rebuffed attempts to explain how the algorithm behind the system was compiled. Campaigners say that once flagged, those being examined can face an invasive and humiliating investigation lasting up to a year.
Related Classifications: Harmful Application, Lack of Transparency
, Snippet Text: The Department for Work and Pensions (DWP) has previously conceded that it uses “cutting-edge artificial intelligence” to track possible fraud but has so far rebuffed attempts to explain how the algorithm behind the system was compiled. Campaigners say that once flagged, those being examined can face an invasive and humiliating investigation lasting up to a year.

Related Classifications: Lack of Transparency
",,,,
GMF,190,False,Content Recommendation,"Snippet Text: The former employees do not know when the scraping they say they were aware of stopped. Two of them say that the scraped content was used to train ByteDance’s powerful “For You” personalization algorithm on US-based content so that it would better reflect the preferences of US users. 
Related Classifications: Content Recommendation
",,,,,"Collaborative Filtering, Web Scraping","Snippet Text: The former employees do not know when the scraping they say they were aware of stopped. Two of them say that the scraped content was used to train ByteDance’s powerful “For You” personalization algorithm on US-based content so that it would better reflect the preferences of US users. 
Related Classifications: Collaborative Filtering, Web Scraping
",,,,,"Unauthorized Data, Misinformation Generation Hazard","Snippet Text: In 2017, TikTok’s parent company, ByteDance, scraped short-form videos, usernames, profile pictures, and profile descriptions from Instagram, Snapchat, and other sources and then uploaded them — without users’ knowledge or consent — to Flipagram, a TikTok predecessor, according to four former employees of the company.
Related Classifications: Unauthorized Data
, Snippet Text: TikTok’s parent company ByteDance made fake accounts with content taken from Instagram, Snapchat and other social media platforms and posted them on Flipagram in 2017, according to a new report today from BuzzFeed News. The report says the company took videos, usernames, pictures and more from the social media platforms and uploaded them to the app without users’ consent or knowledge.
Related Classifications: Unauthorized Data, Misinformation Generation Hazard
",,Harmful Application,"Snippet Text: The former employees described the project as one of several “growth hacks” — including the manipulation of like and video view statistics — employed by the company. One of the former employees said the scraping affected hundreds of thousands of accounts, and a document viewed by BuzzFeed News detailed plans to “crawl video > 10k/day in P0 countries” — according to the former employee, this meant the team’s goal was to scrape more than 10,000 videos a day in the highest priority countries.
Related Classifications: Harmful Application
Snippet Discussion: In the case of knowingly applying scraping without any privacy concerns.
",
GMF,191,False,Product Recommendation,"Snippet Text: According to the Fair Trade Commission‘s announcement, Naver made changes in search algorithms to have products or services sold by those that are linked to its payment service Naver Pay have better exposure on the company’s online shopping platform. It made products sold by other online shopping competitors, such as Interpark and Gmarket, rank lower on search results, according to the FTC.
Related Classifications: Product Recommendation
",,,,,Content-based Filtering,"Snippet Text: According to the Fair Trade Commission‘s announcement, Naver made changes in search algorithms to have products or services sold by those that are linked to its payment service Naver Pay have better exposure on the company’s online shopping platform. It made products sold by other online shopping competitors, such as Interpark and Gmarket, rank lower on search results, according to the FTC.
Related Classifications: Content-based Filtering
",,,,,"Algorithmic Bias, Malicious Marketing, Harmful Application","Snippet Text: South Korea‘s antitrust regulator on Oct. 6 imposed a 26.7 billion won ($22.9 million) fine on Naver, accusing the company of manipulating search algorithms to favor its own online shopping business.
Related Classifications: Algorithmic Bias, Malicious Marketing, Harmful Application
, Snippet Text: The FTC said Naver has been manipulating its search algorithms since 2012, in order to place products from Smart Store above those from competing online marketplaces in search results, and ensure that 20 percent of products per page were also from Smart Store.
Related Classifications: Algorithmic Bias, Malicious Marketing, Harmful Application
",,,,
GMF,193,False,Malware Detection,"Snippet Text: Kerr said there were two different issues relating to the alert problem: While the attack was in progress, monitoring software (FireEye) alerted staff in Bangalore, India, who in turn notified Target staff in Minneapolis. No action was taken because these alerts were included with many other likely false alerts. 
Related Classifications: Malware Detection
",,,,,Classification,"Snippet Text: Kerr said there were two different issues relating to the alert problem: While the attack was in progress, monitoring software (FireEye) alerted staff in Bangalore, India, who in turn notified Target staff in Minneapolis. No action was taken because these alerts were included with many other likely false alerts. 
Related Classifications: Classification
",,,,,"Generalization Failure, Context Misidentification","Snippet Text: Kerr said there were two different issues relating to the alert problem: While the attack was in progress, monitoring software (FireEye) alerted staff in Bangalore, India, who in turn notified Target staff in Minneapolis. No action was taken because these alerts were included with many other likely false alerts. 
Related Classifications: Generalization Failure
, Snippet Text: A survey by FireEye polled C-level security executives at large enterprises worldwide and found that 37 percent of respondents receive more than 10,000 alerts each month. Of those alerts, 52 percent were false positives, and 64 percent were redundant alerts.
Related Classifications: Generalization Failure
, Snippet Text: One of the key takeaways from a recent Rapid7 report was that reducing alert fatigue should always be a goal, but there’s more to it. A better signal-to-noise ratio means responders and analysts are more likely to see meaningful trends. One trend is that attackers still heavily rely on user interaction. For instance, on Monday holidays, alerts dipped significantly, which Rapid7's analysts attributed to a lack of employees interacting with malicious emails, attachments, etc.
Related Classifications: Context Misidentification
",,"Misuse, Misconfigured Threshold","Snippet Text: Kerr recalls that it also appeared that at least some of the company's network infiltration alerting systems were turned off to reduce false positives.
Related Classifications: Misuse, Misconfigured Threshold
",
GMF,194,False,Automatic Fault Handling,"Snippet Text: Firstly, it would remotely resolve the incident by fixing the issue programmatically. If that did not work, it would assume that a technician’s visit is required to customer premises. Accordingly, it would issue a work order to send someone directly. If none of that were apparent, it would present the case to the human operator for further investigation and decision.
Related Classifications: Automatic Fault Handling
",,,,,,,,"Conditional Logic, Classification","Snippet Text: Firstly, it would remotely resolve the incident by fixing the issue programmatically. If that did not work, it would assume that a technician’s visit is required to customer premises. Accordingly, it would issue a work order to send someone directly. If none of that were apparent, it would present the case to the human operator for further investigation and decision.
Related Classifications: Conditional Logic, Classification
",,"Lack of Transparency, Untested Deployment, Lack of Interruptability, Lack of Corrigibility","Snippet Text: Later, the team found out that there were a few incident scenarios only a human operator could understand
Related Classifications: Lack of Transparency
, Snippet Text: The bot development and rollout were not thoroughly tested for all the potential scenarios and thus lacked testing rigor that could have identified problems early on.
Related Classifications: Untested Deployment
, Snippet Text: Now, here was the kicker. Despite finding out the flaw in logic, the automation team was unable to turn off the bot (much like what Microsoft did with Tay in 2016). They had implemented the bot in all or nothing fashion, and it was sitting right in the middle of the user and operator interface. Which meant there were only two possibilities. Either all the incidents would go through the bot and get incorrectly handled more often. Or none of them would go through the bot and thereby getting handled manually.
Related Classifications: Lack of Interruptability, Lack of Corrigibility
, Snippet Text: But the first and foremost question is: why there was no plan B, a kill switch of some sort to stop this bot. 
Related Classifications: Lack of Interruptability
",,,,
GMF,195,False,Predictive Policing,"Snippet Text: Bobby had been identified as a target by the Pasco Sheriff’s Office's 'intelligence-led' policing program. Police had gathered records of Bobby’s previous interactions with law enforcement and were using his history to predict that he would be a troublemaker in Pasco County.
Related Classifications: Predictive Policing
",,,,,Classification,"Snippet Text: Pasco County’s approach to “intelligence-led” policing, developed over a decade, has drawn particular concern from civil liberties experts because of a data-sharing arrangement with the local school district, which was first reported by Tampa Bay Times. That partnership gave the police access to data relating to students’ grades, attendance and behavior as well as any history of abuse or other “adverse childhood experiences.”

School records were used to allocate students one of four labels: on track, at risk, off track or critical. Getting a D grade or having a parent or sibling go to prison could be enough to put a child in the “at risk” category, according to Pasco’s own 83-page “Intelligence-Led Policing Manual,” first obtained by the Tampa Bay Times.
Related Classifications: Classification
, Snippet Text: Police had gathered records of Bobby’s previous interactions with law enforcement and were using his history to predict that he would be a troublemaker in Pasco County.
Related Classifications: Classification
",,,"Snippet Text: Police had gathered records of Bobby’s previous interactions with law enforcement and were using his history to predict that he would be a troublemaker in Pasco County.
Related Classifications: Classification
",,Lack of Transparency,"Snippet Text: The agency does not notify parents of children added to the list but said parents can file a public records request to find out
Related Classifications: Lack of Transparency
",,"Incomplete Data Attribute Capture, Overfitting, Algorithmic Bias, Harmful Application","Snippet Text: Pasco County’s approach to “intelligence-led” policing, developed over a decade, has drawn particular concern from civil liberties experts because of a data-sharing arrangement with the local school district, which was first reported by Tampa Bay Times. That partnership gave the police access to data relating to students’ grades, attendance and behavior as well as any history of abuse or other “adverse childhood experiences.”
Related Classifications: Incomplete Data Attribute Capture
, Snippet Text: Getting a D grade or having a parent or sibling go to prison could be enough to put a child in the 'at risk' category.
Related Classifications: Overfitting, Algorithmic Bias
, Snippet Text: Bobby and his dad say they were never offered any kind of diversion program or support at school or home, only harassment and punishment. The sheriff’s office said the program to identify at-risk students was entirely separate from the ""prolific offender"" program but that Bobby and other adolescent offenders were given a “resource card” featuring details about “opportunities in our community” relating to mental health and substance abuse.
Related Classifications: Harmful Application
, Snippet Text: “It is really, as someone who has studied this, it is jaw-droppingly bad in all aspects,” said Andrew Ferguson, a law professor at American University. “They basically built this system as a justification to chase the bad kids out of town, to monitor them in over-aggressive ways with no intention to help them but to make their lives so miserable that they would leave.”
Related Classifications: Harmful Application
",
GMF,196,False,Identification,"Snippet Text: Pakistan is a leader in the application of identification systems and technology to a range of development issues. The National Database and Registration Authority (NADRA) of Pakistan has become a central player in a number of program areas and has been internationally recognized for its expertise, including winning many awards for excellence.
Related Classifications: Identification
",,,,,Biometrics,"Snippet Text: Pakistan is a leader in the application of identification systems and technology to a range of development issues. The National Database and Registration Authority (NADRA) of Pakistan has become a central player in a number of program areas and has been internationally recognized for its expertise, including winning many awards for excellence.
Related Classifications: Biometrics
",,Face Detection,"Snippet Text: Pakistan is a leader in the application of identification systems and technology to a range of development issues. The National Database and Registration Authority (NADRA) of Pakistan has become a central player in a number of program areas and has been internationally recognized for its expertise, including winning many awards for excellence.
Related Classifications: Face Detection
",,Lack of Authenticity Assurance,"Snippet Text: Many Afghans were able to obtain ID cards by deceiving the paper-based system, and there was no easy way to distinguish these false cards from the real ones.
Related Classifications: Lack of Authenticity Assurance
",,"Unauthorized Data, Privacy Concerns","Snippet Text: It is sad that Pakistan does not yet have an official data privacy law.
Related Classifications: Unauthorized Data, Privacy Concerns
",
GMF,197,False,Content Recommendation,"Snippet Text: For the last six months, Facebook engineers have been seeing intermittent spikes in misinformation and other harmful content on News Feed, with posts that would usually be demoted by the company's algorithms being boosted by as much as 30% instead. 
Related Classifications: Content Recommendation
",,,,,Collaborative Filtering,"Snippet Text: This misinformation came from 'repeat offenders' – users who repeatedly share posts that have been deemed as misinformation by a team of human fact-checkers.

'Instead of suppressing posts from repeat misinformation offenders that were reviewed by the company’s network of outside fact-checkers, the News Feed was instead giving the posts distribution,' the Verge reports.
Related Classifications: Collaborative Filtering
",,,,,Lack of Transparency,"Snippet Text: It will be difficult for those outside of Meta to vet those metrics. Meta has blocked new users from accessing CrowdTangle, one of the core tools researchers and journalists have used to track trends in what's popular on Facebook, and has dismantled the team leading it. And while the company does release reports on the prevalence of certain kinds of policy violations in any given quarter, those reports offer little indication of what's behind those numbers. Even if the report did show an uptick in, say, violence on Facebook, it'd be impossible to know if that's due to this bug or to Russia's invasion of Ukraine or some other global atrocity.
Related Classifications: Lack of Transparency
",,Software Bug,"Snippet Text: The bug first originated in 2019, but its impact was first noticed in October 2021. The company said it was resolved March 11. “We traced the root cause to a software bug and applied needed fixes,” Meta spokesperson Joe Osborne told The Verge.
Related Classifications: Software Bug
",
GMF,199,False,Face Recognition,"Snippet Text: What isn’t obvious on Ever’s website or app — except for a brief reference that was added to the privacy policy after NBC News reached out to the company in April — is that the photos people share are used to train the company’s facial recognition system, and that Ever then offers to sell that technology to private companies, law enforcement and the military.
Related Classifications: Face Recognition
",,,,,"Convolutional Neural Network, Generative Adversarial Network, Distributional Learning","Snippet Text: Rather, the billions of images are used to instruct an algorithm how to identify faces. Every time Ever users enable facial recognition on their photos to group together images of the same people, Ever’s facial recognition technology learns from the matches and trains itself. That knowledge, in turn, powers the company’s commercial facial recognition products.
Related Classifications: Convolutional Neural Network, Generative Adversarial Network, Distributional Learning
",,Transformer,"Snippet Text: Rather, the billions of images are used to instruct an algorithm how to identify faces. Every time Ever users enable facial recognition on their photos to group together images of the same people, Ever’s facial recognition technology learns from the matches and trains itself. That knowledge, in turn, powers the company’s commercial facial recognition products.
Related Classifications: Transformer
",,"Privacy Concerns, Unauthorized Data","Snippet Text: What isn’t obvious on Ever’s website or app — except for a brief reference that was added to the privacy policy after NBC News reached out to the company in April — is that the photos people share are used to train the company’s facial recognition system, and that Ever then offers to sell that technology to private companies, law enforcement and the military.
Related Classifications: Privacy Concerns
, Snippet Text: Sarah Puchinsky-Roxey, 22, from Lemoore, California, used an expletive when told by phone of the company’s facial recognition business. “I was not aware of any facial recognition in the Ever app,” Roxey, a photographer, later emailed, noting that she had used the app for several years. “Which is kind of creepy since I have pictures of both my children on there as well as friends that have never consented to this type of thing.”
Related Classifications: Privacy Concerns, Unauthorized Data
",,Harmful Application,"Snippet Text: Ever AI promises prospective military clients that it can “enhance surveillance capabilities” and “identify and act on threats.” It offers law enforcement the ability to identify faces in body-cam recordings or live video feeds.
Related Classifications: Harmful Application
",
GMF,200,False,Voice Generation,"Snippet Text: Criminals used artificial intelligence-based software to impersonate a chief executive’s voice and demand a fraudulent transfer of €220,000 ($243,000) in March in what cybercrime experts described as an unusual case of artificial intelligence being used in hacking.
Related Classifications: Voice Generation
",,,,,,,,"Recurrent Neural Network, Transformer, Convolutional Neural Network, Spectrogram, Generative Adversarial Network","Snippet Text: Criminals used artificial intelligence-based software to impersonate a chief executive’s voice and demand a fraudulent transfer of €220,000 ($243,000) in March in what cybercrime experts described as an unusual case of artificial intelligence being used in hacking.
Related Classifications: Recurrent Neural Network, Transformer, Convolutional Neural Network, Spectrogram, Generative Adversarial Network
",,"Misinformation Generation Hazard, Unsafe Exposure or Access","Snippet Text: Criminals used artificial intelligence-based software to impersonate a chief executive’s voice and demand a fraudulent transfer of €220,000 ($243,000) in March in what cybercrime experts described as an unusual case of artificial intelligence being used in hacking.
Related Classifications: Misinformation Generation Hazard, Unsafe Exposure or Access
",,,,
GMF,201,False,Deepfake Video Generation,"Snippet Text: A deepfake video showing Belgium’s prime minister speaking of an urgent need to tackle the economic and climate crises has been put into circulation by Extinction Rebellion Belgium.
Related Classifications: Deepfake Video Generation
",,,,,"Face Detection, Recurrent Neural Network, Generative Adversarial Network","Snippet Text: Neural Network, Face Detection, Recurrent Neural Network, Generative Adversarial Network
Related Classifications: Face Detection, Recurrent Neural Network, Generative Adversarial Network
",,,,,"Misinformation Generation Hazard, Unsafe Exposure or Access","Snippet Text: Neural Network, Face Detection, Recurrent Neural Network, Generative Adversarial Network
Related Classifications: Misinformation Generation Hazard, Unsafe Exposure or Access
",,,,
